id,job_id,title,sector,employer,country,closing_date,summary
3755,38154,General Worker,Transport and Storage,MS WAREHOUSING AND LOGISTICS LTD,Mauritius,30.08.2025,"MS Warehousing & Logistics Ltd is recruiting dynamic and self-motivated General Workers to assist in the day-to-day running of its Logistics Activities.If you feel you have the qualities, drop your CV on the following Email Address or call on 52569330.Email Address: adaroga@mswl.mu"
4705,38117,HVAC Technician,Construction,SERVICE TECHNIQUE DU BATIMENT (STB) LTEE,Mauritius,31.08.2025,Site Installation works in respective field
4707,37847,Storekeeper,Construction,SERVICE TECHNIQUE DU BATIMENT (STB) LTEE,Mauritius,31.08.2025,"STB Ltee is looking for a motivated candidate to work as Storekeeper, to handle our 2 stores and facilitate the procurement department."
4708,37769,"Driver, Truck/Goods Vehicle/Chauffeur Poid-Lourd",Manufacturing-Other,WINDOORS PROFESSIONAL LTD,Mauritius,31.10.2025,"We are looking for a licensed truck driver who will be responsible for the safe and timely delivery of goods and other articles of trade to our sites. You will be tasked with driving and maintaining trucks that will be assigned to you, as well as working closely with our team of dispatchers in order to plan routes and track deliveries."
2499,37479,Aluminium Assembler,Manufacturing-Other,WINDOORS PROFESSIONAL LTD,Mauritius,31.10.2025,"We are looking for technically skilled candidates with good attention to detail for the position of fabricator. Fabricators are responsible for adhering to a production schedule, ensuring that all parts are properly fitted, aligned and secured and ensuring that safety standards are always met, among other duties.Moreover, fabricators will be physically able workers who have good dexterity, color vision and stamina."
2500,37478,Glass Cutter / Glass Installer,Manufacturing-Other,WINDOORS PROFESSIONAL LTD,Mauritius,31.10.2025,"We are looking to hire a talented and professional glazier to measure, cut, and install glass fittings in homes and businesses. A glazier’s responsibilities include working with blueprints to cut glass to specifications, assembling and fitting glass in shop windows, sliding doors, display cases, bathroom units, and other home or commercial structures.To be successful as a glazier, you should have detailed knowledge of the glass manufacturing and cutting process, have good eye-hand coordination, be able to lift heavy objects, and have excellent communication skills. Ultimately, a top-notch glazier provides a positive customer experience while constantly meeting high professional standards."
297,36943,Programme Support Officer,Social Services,T1DIAMS,Mauritius,31.07.2025,"T1 Diams, the NGO providing multi-disciplinary support to people living with Type 1 diabetes in Mauritius and Rodrigues Island is looking for a multi-tasker with excellent communication skills and upbeat attitude to be our Programme Support Officer cum Driver."
298,36942,Communication and Event Trainee,Social Services,T1DIAMS,Mauritius,31.07.2025,"We got an amazing internship for you!We are looking for a creative and passionate Communication and Event Intern on YEP Scheme for 1 Year to work in our Communication department at T1 Diams, the NGO providing multidisciplinary support to people living with Type 1 diabetes in Mauritius and Rodrigues Island."
299,36598,Administrative Assistant,Administrative,GHYDRO BROS & SONS LTD,Mauritius,23.08.2025,We are looking for administrative assistant for Ghydro Bros And Sons Ltd
2508,34951,Storekeeper,Manufacturing-Other,WINDOORS PROFESSIONAL LTD,Mauritius,31.10.2025,"We are looking for an organized store keeper to form part of the Store team.To be successful as a store keeper you must be able to multitask and perform under pressure while remaining professional with customers. A good store keeper is able to manage stock by keeping a record of sales and ordering the required replacement items, occasionally making new product purchases that consumers may enjoy."
3329,33401,Store Attendant,Trade,METEX TRADING CO LTD,Mauritius,25.08.2025,Responsible for the attendading to all store requirement
4725,32528,"Messenger, Office",Transport and Storage,AQUALINE LOGISTICS LTD,Mauritius,31.07.2025,dispatch/collection of documents & packages and other items as requiredbe available to support other employees as requiredbe available to work outside office hours as may be required
307,32373,Offset Press Operator,Printing,PRECIGRAPH LTD,Mauritius,08.10.2025,"MISSIONPrécigraph est une entreprise expérimentée qui propose des services d’arts graphiques depuis 1973.Notre personnel qualifié et notre parc de machines garantissent des produits et des services à forte valeur ajoutée permettant à nos clients nationaux et internationaux de promouvoir efficacement leur image.VISIONPassionnés de précision, déterminés à repousser nos limites et engagés à servir afin de contribuer en équipe au succès durable de nos partenaires.VALEURSNotre mission et notre vision reposent sur ces 5 valeurs :PrécisionRéactivitéEnthousiasmeCaringIntégrité"
2516,32182,Accounts clerk,Manufacturing-Other,WINDOORS PROFESSIONAL LTD,Mauritius,30.09.2025,"We are looking for a skilled Accounting Clerk to perform a variety of accounting, bookkeeping and financial tasks.Accounting Clerk responsibilities include keeping financial records updated, preparing reports and reconciling bank statements.  A successful accounting assistant should be familiar with all accounting procedures and have a flair for numbers.Ultimately, a successful Accounting Clerk will ensure that the company’s daily accounting functions run accurately and effectively."
2517,31600,Accounting Officer,Manufacturing-Other,WINDOORS PROFESSIONAL LTD,Mauritius,31.08.2025,"We are looking for an Accountant to manage all financial transactions, from fixed payments and variable expenses to bank deposits and budgets, bookkeeping and financial tasks.Accountant responsibilities include auditing financial documents and procedures, reconciling bank statements and calculating tax payments and returns. To be successful in this role, you should have previous experience with bookkeeping and a flair for spotting numerical mistakes.Ultimately, you will provide us with accurate quantitative information on financial position, liquidity and cash flows of our business, while ensuring we’re compliant, by running the daily accounting functions accurately and effectively."
2519,30696,Aluminium Light Metal Operator,Manufacturing-Other,WINDOORS PROFESSIONAL LTD,Mauritius,31.10.2025,"We are looking for skilled Aluminium Operators to connect parts into more complex components. You will ensure all parts fit correctly and are suitable for the final product. You will use your hands or machines to do the job with greater precision.You must have good technical knowledge and possess great manual dexterity. Ability to read instructions represented in manuals, drawings, schematics etc. and follow them with precision is extremely important."
310,30557,"Driver, Van, Light and Local Transport",Manufacturing-Food Products & Beverages,FLORESCO LTD,Mauritius,03.12.2025,Driver (private car license)
311,30368,Butcher,Trade,IBL LTD (BRANDACTIV),Mauritius,31.07.2025,The job incumbent will be requested to support the Operation’s team.
315,29902,Education Officer,Education,AKSA VENTURES LTD,Mauritius,31.12.2025,"Course instructors for international math program, children aged 4 to 14 years"
2530,28704,"Driver, Private Car",Travel & Tours,SUMMERTIMES (MANAHE LTD),Mauritius,31.08.2025,DRIVERS - SIXT RENT A CARApply on hr@summer-times.com
3350,26107,"Driver, Truck/Goods Vehicle/Chauffeur Poid-Lourd",Trade,METEX TRADING CO LTD,Mauritius,25.08.2025,We are looking for suitable Goods Vehicle Driver with a clean and valid driving license.
321,24416,"Driver, Truck/Goods Vehicle/Chauffeur Poid-Lourd",Trade,IBL LTD (BRANDACTIV),Mauritius,31.07.2025,He has the responsibility to deliver products to customers in a safe and timely manner. He must also ensure cash collection and maintain records.
4269,24029,"Architect, Interior Design",,CAUNHYE CONCEPT FURNITURE LTD,Mauritius,31.10.2025,"Recherche Designer de Cuisine et ameublement interieur - vendeur professionelle et qualifieA PaillesHabitant de la localiteAptitudes Primaries:Experience en CAD, 3D Design softwareA l’aise avec les clients, en negociation-Permis de conduire recommendePropre voiture aussiAssistant commerciale-Vendre les cuisines ou meubles d’interieurs du marque de marque au magasin/au salon de la maison/ou au domicile des clientsAcceuillir la clientele et decouvrir ses besoinsEtre a l’ecoute du clientRealiser et le metre a domicileNegocier et conclure la venteConnaitre l’informatique, montage des cuisines et autres aptitudesIl est oblige de travailler aux evenements des salons.Salaire variables sur l’experience: peut en discuter a l’entretien dependant l’experienceSalaire sans experience: Basic et negotiableJour de travaille: Lundi - Samediet aux jours de slalon, jour de noel etc.Samedi est negotiable."
322,19272,Accountant,BPO/ICT,APHELION LIMITED,Mauritius,17.10.2025,"Be responsible for all areas of the Companies accounts, reporting to and advising the Operations Director. Ensuring compliance with statutory laws and tax regulations."
323,18435,Administrative Assistant,Construction,CIVELMEC GROUP LTD,Mauritius,31.07.2025,To assist the administrative manager in his works
324,15747,IT Technician,BPO/ICT,APHELION LIMITED,Mauritius,31.10.2025,"Aphelion currently has an opportunity for a professional and experienced individual to fill the role of IT Support Technician. In this position, the successful applicant will be responsible for maintaining the integrity of all computer workstations and associated software within the office building. The IT Technician will also be the main point of contact for employees who are experiencing computer issues. This is an excellent opportunity for the right individual to join a dynamic and industry leading technology company."
325,11322,Maintenance Technician,"Electricity, Gas, Steam & Air Conditioning supply",LGI,Mauritius,31.07.2025,Carry out the maintenance tasks in the factory premises and offices.
326,11080,Storekeeper,Construction,CIVELMEC GROUP LTD,Mauritius,31.07.2025,Storekeeping of building services materials
4276,11006,Clerical Officer / Clerk,,CAUNHYE CONCEPT FURNITURE LTD,Mauritius,31.10.2025,"Urgent:Looking a clerk for adminstrative duties at PaillesSomeone willing to work for long-term basis, willing to work 6 working days from Monday to Saturday, 09:00-17:30, living nearby Bagatelle in the region of Moka,Plaine-Wilhems,PaillesHaving own car is really beneifcial and driving licenseKnowledge in auto cad, 2d design, 3d design will be convenientTasks consists of:Taking phone calls and messages and direct relevant information to othersWelcoming clients in shopsAssisting salesmanAssisting superiorsTaking messageTaking clients paymentGuiding clientsReplying emailsDoing some payments nearbyFilingCall clientsSchedule meetingsSchedule deliveryHandle outdoor workersPerform personal tasks for directorsFollow up working list or planning"
4756,8869,"Plumber and Pipe Fitter, General",Construction,SERVICE TECHNIQUE DU BATIMENT (STB) LTEE,Mauritius,31.08.2025,"• Carry out plumbing works mainly on constructionsites, building under renovation and industrialbuilding.• Plumbing works shall comprise installation of hotwater, cold water, waste and sewer, fire-fightingand general piping network."
4757,8866,Electrician,Construction,SERVICE TECHNIQUE DU BATIMENT (STB) LTEE,Mauritius,31.08.2025,"• Carry out electrical works on construction sites, industrial sites, existing building, and building under renovation.• Carry out tasks linked with fire alarm, CCTV,MATV, public address system."
4277,7089,Painter,"Electricity, Gas, Steam & Air Conditioning supply",LGI,Mauritius,31.07.2025,Painting of Gas cylinders
2541,6211,"Driver, Bus",Travel & Tours,SUMMERTIMES (MANAHE LTD),Mauritius,31.08.2025,DRIVERSApply on hr@summer-times.com
