id,job_id,title,sector,employer,country,closing_date,summary
4289,45546,Security Guard,Construction,WENSENG CONTRACTING CO LTD,Mauritius,31.10.2025,"It is responsible for protecting people, property and assets"
4290,45545,Cashier,Construction,WENSENG CONTRACTING CO LTD,Mauritius,15.10.2025,"Hanfling payment , process customer transactions accurately"
4291,45544,Maid,Education,KNOWLEDGEPLUS LTD,Mauritius,23.08.2025,House CleaningT: 52516419
4301,45534,Administrative Clerk,Manufacturing-Furniture,USTAD FURNITURE CO LTD,Mauritius,31.08.2025,"Adminstration work like filling , record data for invoice input and output, record company’s day to day running activities ect"
4315,45520,Team Leader,Engineering Services,CHANTIER NAVAL DE L'OCEAN INDIEN LTD,Mauritius,24.08.2025,"Industrie et Services de l’Océan Indien Ltd, société subsidiaire du Chantier Naval de l’Océan Indien Ltd, recherche un Superviseur d’Atelier expérimenté pour encadrer une équipe technique dans la réalisation de travaux de métaux (chaudronnerie, soudure, peinture, etc.)."
4318,45517,Sales Representative,Sports and Leisure,EMPERATOR DIVING CENTER,Mauritius,07.08.2025,Représenter notre centre de plongée dans un hotel 5* à Grand Baie.
4323,45511,Planning Coordinator,Construction,SERVENG LIMITED,Mauritius,31.08.2025,"-To support our daily activities and drive operational excellence-Draft,create and process various documents such as letters,reports,memos and emails-Manage purchase requisitions and purchase orders-Manage maintenance/servicing appointments for vehicles and machinery-Provide administrative support and project coordination to multiple teams within the organisation-Actively contribute to maintain and promote a strong safety culture aligned with company standards"
4329,45505,Marketing Officer/Assistant,BPO/ICT,APHELION LIMITED,Mauritius,31.12.2025,We are looking for a creative and motivated Marketing Officer to join our team and support our marketing and branding - ideal for fresh graduates or students in their final year.
4332,45502,Sales Representative,Renewable Energy and Circular Economy,AUSTRAL SOLAR LIMITED,Mauritius,23.08.2025,"Company PresentationFounded in 2016 with the goal of addressing ecological challenges and reducing our impact on the planet, we chose to invest sustainably by focusing on what matters most: high-end equipment and exceptional personalized service.Our mission is to guide our clients toward the future with innovative, sustainable, and profitable systems.Austral Energie is a trusted brand serving communities, socially responsible, and committed to improving everyday life. Our goal is to offer added value to our clients through exceptional products and unmatched service. By listening to our clients, we build projects and develop long-term relationships with them.We value our employees and are committed to supporting their personal development. At Austral, we are convinced that renewable energy represents the future of energy consumption, and we encourage communities to work toward sustainable development.In 2021, we were a small agency with only about ten employees in Réunion Island.Today, Austral Énergie is represented by around 300 professionals, not only in Réunion but also in Mauritius, mainland France, and Belgium."
4355,45479,Accounts clerk,Manufacturing-Other,M. SAVERS LTD,Mauritius,22.08.2025,"- Handle daily accounting tasks- Process Invoices- Process payment to suppliers-Enter financial data into ledgers and accounting systems.-Make deposits and withdrawals, and reconcile bank statements.-Prepare, check, and reconcile accounts regularly."
4358,45476,Accountant,Manufacturing-Other,M. SAVERS LTD,Mauritius,21.08.2025,"• Handle daily accounting tasks including accounts payable, receivable, payroll, and bank reconciliations• Prepare and maintain accurate monthly, quarterly, and yearly financialreports• Ensure compliance with tax laws and statutory reporting requirements• Track and analyze sales, expenses, and inventory data• Assist in budget preparation and financial forecasting• Support stocktaking and audit processes• Collaborate with management to provide financial insights for decision-making"
4360,45474,Fast Food Operator,Hotel,MOM'S - THE QUEEN OF FUSION FOOD,Mauritius,30.08.2025,"preparing, according to procedures laid down by the unit, food, snacks and other in-house specialities;attending to and serving customers,taking charge of bills or being responsible for cash takings,"
3838,45433,Trainee Engineer,Engineering Services,AXIS ENGINEERS LTD,Mauritius,31.08.2025,TRAINEE/JUNIOR MECHANICAL ENGINEER-Degree in Mechanical Engineering-Minimum 1-3 years experience-Well versed in AutoCAD-Valid driving license (Manual)Interested candidates are invited to send their CV directly to info@axisengineers.mu
3844,45427,Project Coordinator,Construction,WENSENG CONTRACTING CO LTD,Mauritius,30.09.2025,"Help follow up on aluminium fascade and curtain walls projects from start to finish . you will work closely with the managing director and technical director , as well as withour internal team, main contractors to ensure that all projects are completed on time and up to the expected standards"
3372,45422,"Driver, Private Car",Construction,S M S CONTRACTING LTD,Mauritius,31.07.2025,"A truck’s driver job summary involves the safe and timely transportation of goods and materials over various distances, often requires loading and unloading cargo, maintaining their vehicle and adhering to traffic laws and company policies"
3374,45420,Site Clerk,Construction,"B.L. HARBERT INTERNATIONAL, L.L.C",Mauritius,31.07.2025,"Administrative and Clerical Support:Record Keeping:Maintaining accurate and up-to-date records of mechanical drawings, specifications, instructions, and variation records.Document Management:Organizing and managing documents related to mechanical engineering projects, including reports, correspondence, and technical data.Communication:Facilitating communication between engineers, contractors, and other stakeholders, including scheduling meetings and preparing reports.Procurement:Assisting with the procurement of mechanical parts and materials, including obtaining quotes, preparing purchase orders, and tracking inventory.Inventory Management:Maintaining records of mechanical parts, tools, and equipment, including physical counts and computerized inventory systems.Technical Support:Quality Control:Monitoring the quality of work during installation and construction, ensuring it complies with specifications and standards.Testing and Commissioning:Witnessing and recording tests and commissioning activities related to mechanical systems, ensuring they meet requirements.Site Inspections:Conducting regular site inspections to assess the progress and quality of work, identifying any issues or deviations from plans.Technical Documentation:Assisting in the preparation of technical documentation, including reports, specifications, and operation and maintenance manuals"
3376,45418,Chef de Rayon,Trade,SOFLO DISTRIBUTION LTD,Mauritius,31.08.2025,"To manage a sales area within a store, ensuring organization, stock management, and customer satisfaction. They also supervise a team of salespeople and contribute to achieving commercial objectives. Their activities include product placement, managing promotions, tracking sales, and analysing results."
3388,45406,Electrician,Manufacturing-Metal Products,FURNICON LTD,Mauritius,31.08.2025,Electrician
3389,45405,"Driver, Private Car",Manufacturing-Metal Products,FURNICON LTD,Mauritius,31.08.2025,Driver
3390,45404,Welder,Manufacturing-Metal Products,FURNICON LTD,Mauritius,31.08.2025,Welder task relatedSend CV or message on whatsapp 5714-4444
3391,45403,Cleaner,Manufacturing-Metal Products,FURNICON LTD,Mauritius,31.08.2025,"The Office Cleaner is responsible for maintaining a clean, orderly, and hygienic environment within office premises. Duties include sweeping, mopping, dusting, emptying trash bins, cleaning restrooms, and ensuring that all areas such as workspaces, meeting rooms, and common areas remain neat and sanitized."
3392,45402,Store Clerk,Manufacturing-Metal Products,FURNICON LTD,Mauritius,31.08.2025,"he Storekeeper is responsible for managing inventory, receiving and issuing goods, and ensuring proper storage and record-keeping of stock. This role involves maintaining accurate stock levels, organizing the storage area, preparing inventory reports, and coordinating with other departments for stock requirements. The Storekeeper ensures that all materials are stored securely and in compliance with company procedures and safety standards."
3393,45401,Administrative Clerk,Manufacturing-Metal Products,FURNICON LTD,Mauritius,31.08.2025,"The Administrative Clerk provides essential administrative and clerical support to ensure efficient operation of the office. Responsibilities include handling office tasks such as filing, data entry, scheduling, preparing documents, managing correspondence, and assisting both staff and clients."
3395,45399,Regulatory Affairs Officer,Human Health & Social work activities,CAP RESEARCH LTD,Mauritius,31.07.2025,"We are seeking a detail-oriented and organized Regulatory Assistant to support regulatory and ethics submissions and maintain documentation required for the approval and conduct of clinical trials. The Regulatory Assistant will play a key role in ensuring compliance with local, national, and international regulations and guidelines governing clinical research. The Regulatory Assistant  will support and report to the Project Manager in these tasks and liaise with the representatives of the sponsor of the clinical trials and other stakeholders accordingly."
2948,45389,Technical Sales Representative,Telecommunication,GLOBALCOM CO LTD,Mauritius,31.08.2025,"We are looking for a dynamic and self-driven Technical Sales Representative to promote and sell our range of ICT-related products and services. The ideal candidate is sales-oriented, tech-savvy, and thrives in a fast-paced environment."
2950,45387,Carpenter,Construction,LAVAL SWAMBAR CO LTD,Mauritius,31.08.2025,"We are currently looking for a motivated and hardworking Carpenter to join our team. Whether you’re just starting out or already have experience in the field, we welcome your application. You will assist in the construction, installation, and repair of wooden structures and fittings, including doors, windows, cabinetry, and furniture.Requirements:Basic understanding of tools and measurementsWillingness to learn and follow instructionsPhysically fit and able to work in a construction or workshop environmentPositive attitude and team spiritExperience:No prior experience required — full training will be providedCandidates with experience will be renumerated according to skill and years of experience"
2188,45318,Office Attendant,Banking & Finance,TOUKAN CORPORATE SERVICES LIMITED,Mauritius,29.08.2025,"We are seeking a reliable and proactive office attendant with a valid driving license to support daily office operations. The ideal candidate will assist with clerical tasks, maintain office cleanliness, and handle transportation duties such as delivering documents or picking up supplies."
333,45309,Legal Officer,BPO/ICT,INTERNATIONAL SOS AFRICAN SERVICES LTD,Mauritius,29.08.2025,"Business Unit Overview: Provides corporate secretarial advice and support, maintains statutory records, ensures compliance with local laws, supports audits, manages agreements, and oversees the group incentive scheme.Overall, Purpose: Ensures legal and regulatory compliance for companies in Africa, MENA, Russia, and Kazakhstan. ? Acts as a communication focal point for Boards of Directors and manages corporate matters like mergers, acquisitions, and restructurings. ?"
20,45257,Nurse Practitioner,BPO/ICT,INTERNATIONAL SOS AFRICAN SERVICES LTD,Mauritius,01.09.2025,"The Coordinating Nurse position is a non-bedside nursing role in a dynamic international setting. You will perform robust telephonic medical assessments of patients, offer personalized advice and referrals, and manage complex cases.• Shift work including occasional overtime based on operational requirements.• Shift work in accordance with a pre-published duty roster(24 hours a day, 365 days a year)"
22,45255,Customer Support Specialist,BPO/ICT,INTERNATIONAL SOS AFRICAN SERVICES LTD,Mauritius,01.09.2025,"Would you like to make a difference every day?Are you looking for a new challenge in a fast-paced environment?Would you like to be a part of a truly international organization?• We are looking for empathetic customer-centric individuals to join a dynamic inbound call center team based in Moka, Mauritius.• Your role will be to manage inbound calls and ensure cases are managed effectively. This is an excellent opportunity for someone with previous experience in a customer service role who is looking for long term career progression.• Shift work including occasional overtime based on operational requirements.• Shift work in accordance with a pre-published duty roster (24 hours a day, 365 days a year)Important information :• Permanent Contract• Rotating working hours• Starting date: August 2025• Office based position (No remote)• Location: Moka, Mauritius"
35,45242,Administrative Assistant,Human Health & Social work activities,CAP RESEARCH LTD,Mauritius,31.07.2025,"We are seeking a highly motivated and detail-oriented Clinical Research Assistant to support the conduct of clinical trials in accordance with regulatory, ethical, and institutional guidelines. The clinical research assistant will assist with study coordination, participant recruitment, data collection, documentation, and communication among stakeholders to ensure the integrity and success of the research studies. The clinical research assistant is the administrative support of the medical, pharmacy & laboratory team during a clinical trial and liaises with the representatives of the sponsor of the clinical trial accordingly. The clinical research assistant will support and report to the Project Manager in these tasks."
36,45241,Human Resource Officer,Construction,METASIGN COMPANY LTD,Mauritius,31.08.2025,Metasign Co Ltd is looking for dynamic Human Resources Officer who will assist with the day-to-day operations of the HR functions and duties.
104,45140,Store Attendant,Manufacturing-Electronics & Electrical Products,FLUX LTD,Mauritius,31.12.2025,Store Attendant
115,45110,Lecturer,Education,CONFEDERATION OF INTERNATIONAL TALENTS LTD,Mauritius,31.08.2025,"Confederation of International Talents (CIT) is a dynamic and MQA-approved educational institution in Mauritius, dedicated to providing high-quality, globally recognized qualifications. As an accredited centre for OTHM, UK, we offer a range of professional diplomas designed to empower students for success in various industries, including Hospitality and Tourism. We are committed to nurturing cognitive development, critical thinking, and professional growth in our students.We are seeking a passionate, experienced, and dedicated Lecturer in Hospitality Management to join our academic team. This is an exciting opportunity to contribute to the development of future leaders in the vibrant hospitality and tourism sector.Position: Lecturer in Hospitality ManagementLocation: Royal Road, Pamplemousses, Mauritius"
116,45109,Lecturer,Education,CONFEDERATION OF INTERNATIONAL TALENTS LTD,Mauritius,31.08.2025,"Confederation of International Talents (CIT) is a dynamic and MQA-approved educational institution in Mauritius, dedicated to providing high-quality, globally recognized qualifications. As an accredited centre for OTHM, UK, we offer a range of professional diplomas designed to empower students for success in various industries, including Hospitality and Tourism. We are committed to nurturing cognitive development, critical thinking, and professional growth in our students.We are seeking a passionate, experienced, and dedicated Lecturer in Hospitality Management to join our academic team. This is an exciting opportunity to contribute to the development of future leaders in the vibrant hospitality and tourism sector.Position: Lecturer in Hospitality ManagementLocation: Royal Road, Pamplemousses, Mauritius"
2300,45085,Driver-Messenger,"Electricity, Gas, Steam & Air Conditioning supply",HAPPY HOUSE LTD,Mauritius,30.09.2025,WE’RE HIRING – RIDER/MESSENGER WANTED!Are you a reliable and safety-conscious driver looking for a new opportunity? Join our dynamic team and take the wheel of your career!Location: Happy House Ltd Port-Louis/ BagatelleWorking Hours: 08h30 to 17hr00 and Sat: 08h30 to 13hr00Start Date: Immediate
130,45055,Sales Assistant,Fashion and Design,TALLY WEIJL/PROMOD/MOA OUTLET,Mauritius,31.07.2025,"As a Sales Assistant, you will play a key role in providing excellent customer service and creating a positive shopping experience. You will assist customers in finding product that suits their needs, maintain a well-organized and visually appealing store, and support sales operations. This position is perfect for individuals passionate about fashion and customer engagement."
131,45052,Gardener,Trade,SOFLO DISTRIBUTION LTD,Mauritius,31.07.2025,"Maintaining and enhancing the beauty of plants, outdoor grounds, and trees within a garden."
138,45029,Administrative Officer,Manufacturing-Other,YIPTONG & SONS LIMITED,Mauritius,31.07.2025,To provide end-to-end administrative and operational support to the team. The Administrative Officer ensures timely order processing and stock accuracy.
140,45022,Fork-Lift Truck Operator,Manufacturing-Other,YIPTONG & SONS LIMITED,Mauritius,31.07.2025,To operate forklift truck in the Warehouse at Geoffroy
147,44987,"Driver, Truck/Goods Vehicle/Chauffeur Poid-Lourd",Manufacturing-Other,YIPTONG & SONS LIMITED,Mauritius,31.07.2025,- Perform deliveries of Customers-Take Responsibility of goods in transit- Maintain good working relation with customers
154,44945,Factory Worker,Trade,REY & LENFERNA,Mauritius,31.08.2025,"We are looking for a technically skilled Factory Workers to handle and control winding and dyeing machines and equipment. The latter inspects materials, identifies, and reports non-conformances to achieve high-quality and visually appealing finished textile products."
155,44942,Sales Assistant,Trade,SIMELEC LTÉE,Mauritius,31.08.2025,"We are seeking a motivated and enthusiastic Sales Assistant to join our sales team.In this role, you will be expected to assist with selling products, merchandise, and services to customers, as well as handling customer inquiries and complaints.Your responsibilities will include understanding the needs of our customers, keeping the sales floor stocked with merchandise and ensuring that it is presented attractively.The ideal candidate is a self-starter with a true talent for communicating with others.You should be able to learn our products and services and articulate their value to potential customers."
156,44941,Warehouse Coordinator / Supervisor,Trade,SIMELEC LTÉE,Mauritius,31.08.2025,"We are seeking a reliable, detail-oriented Warehouse Supervisor to oversee all warehouse activities, including receiving, storing, and dispatching items. Oversee and coordinate daily warehouse activities such as receiving and storing goods, managing inventory levels, ensuring the efficient delivery of products, and maintaining warehouse safety. Responsible for team leadership and for ensuring the smooth running of the warehouse.This position may require working in various weather conditions and requires physical activity."
160,44909,Sales Assistant,Manufacturing-Other,MYSA MAISON LTD,Mauritius,31.07.2025,"We are seeking a hardworking and customer-focused individual to join our retail team as a Store & Sales Assistant. The ideal candidate will effectively manage stock and assist customers, ensuring a seamless shopping experience.Retail Shop (Grand Baie, Tamarin, Soflo)"
161,44904,Accounting Officer,Manufacturing-Other,MYSA MAISON LTD,Mauritius,31.07.2025,"We are looking for a detail-oriented and proactive Accounts Officer to join our team. The successful candidate will be responsible for handling invoicing, costing, and assisting with administrative tasks to ensure the smooth operation of the office. This role requires a high level of accuracy and the ability to work independently. The key objective is to assist the Accountant to oversee and manage the transactional finance activities including internal controls."
2341,44843,Maintenance Officer,Hotel,TEMPO REAL LTD,Mauritius,31.07.2025,"The Maintenance Officer is responsible for performing routine and emergency maintenance tasks to ensure the hotel’s facilities, equipment, and systems operate safely and efficiently. This includes repairs, inspections, and preventative maintenance across plumbing, electrical, mechanical, and general building systems.Interested candidates may apply by:Calling: 265 6815Sending your CV to: hr@hotel-lepalmiste.mu"
2342,44842,Night Auditor,Hotel,TEMPO REAL LTD,Mauritius,31.07.2025,"The Night Auditor is responsible for overseeing hotel operations during the night shift, ensuring all financial and guest service tasks are completed accurately. This role combines accounting duties with front desk responsibilities, ensuring that the hotel runs smoothly overnight and that daily financial reports are accurate and ready for management.Interested applicants may apply by:Calling: 265 6815Sending your CV to: hr@hotel-lepalmiste.mu"
2343,44841,Receptionist,Hotel,TEMPO REAL LTD,Mauritius,31.07.2025,"The Hotel Receptionist is the first point of contact for guests and plays a key role in providing a warm welcome and delivering excellent customer service throughout the guest’s stay. The receptionist handles check-in and check-out procedures, manages reservations, and responds to guest inquiries with professionalism and efficiency.Interested applicants may apply by:Calling: 265 6815Sending your CV to: hr@hotel-lepalmiste.mu"
2346,44831,Housekeeping Supervisor,Hotel,TEMPO REAL LTD,Mauritius,31.07.2025,"The Housekeeping Supervisor is responsible for overseeing the daily operations of the housekeeping department to ensure the highest standards of cleanliness, order, and appearance throughout the hotel. This role includes supervising housekeeping staff, coordinating tasks, conducting inspections, and ensuring guest satisfaction.Interested candidates are invited to apply by:Calling: 265 6815Sending your CV to: hr@hotel-lepalmiste.mu"
3598,44814,Health and Safety Officer,Management Consultancy Activities,ESSENTIAL OXYGEN LTD,Mauritius,31.07.2025,"We are seeking a Junior Health & Safety Officer to support experienced safety and health professionals in maintaining a safe and healthy work environment. This role involves assisting with various tasks and provides an excellent opportunity to build essential skills in risk assessment, safety training, policy implementation, and compliance monitoring."
4552,44742,Beautician/ Beauty Therapist / Esthéticienne,Management Consultancy Activities,GWENS PROPERTIES LTD,Mauritius,21.08.2025,"Un de nos clients dans l’Ouest :Donne une formation gratuite de Technicien(ne) en extension de cils (avec promesse d’embauche)Horaires :Du lundi au dimanche de 9hrs00 à 17hrs00 (deux jours de repos par semaine, incluant un dimanche)Avantages:Option 1 : Contrat Durée IndéterminéSalaire de base de Rs 17,500 ,Prime de performance trimestrielle de Rs 3,000Prime de 10% sur les ventes de produitsPrime sur objectif de vente de produitTransport rembourséOption 2 : Free-lanceCommission de 15% sur chaque service effectuéHoraires flexiblesTransport rembourséMerci de nous envoyer votre CV sur recrutement@gml-mu.com ou au 5255 7740 / 5840 2010 par WhatsApp en précisant bien quel est le poste qui vous intéresse"
4555,44737,Project Coordinator,Management Consultancy Activities,GWENS PROPERTIES LTD,Mauritius,21.08.2025,"Recherche pour l’un de ses clients dans le centre :Un(e) Coordinateur (trice) de projet - Transformation et automatisationAvantages: :Salaire entre Rs 35,000 et Rs 50,000 (selon expérience).Assurance médicale prise en charge à 50% par l’entreprise.Télétravail possible 2 fois par semaine (après validation).Contrat en CDI.Horaires:Du lundi au vendredi de 9hrs à 17hrs30Merci de nous envoyer votre CV sur recrutement@gml-mu.com ou au 5255 7740/5840 2010 par WhatsApp en précisant bien quel est le poste qui vous intéresse"
4556,44736,Baker,Management Consultancy Activities,GWENS PROPERTIES LTD,Mauritius,21.08.2025,"Recherche pour l’un de ses clients dans le Nord:Un Commis boulangerAvantages :Salaire de base Rs 24,000 incluant une prime de présenceTransport aller-retour pris en charge rembourséHeures supplémentaires rémunérées et contrat en CDIDimanche payé selon la loi du travailHoraires :Du lundi au dimanche de 1h30 am à 08h30 am1 jour off par semaineMerci de nous envoyer votre CV sur recrutement@gml-mu.com ou au 5255 7740 / 5840 2010 par WhatsApp en précisant bien quel est le poste qui vous intéresse"
4559,44733,"Cook, General",Management Consultancy Activities,GWENS PROPERTIES LTD,Mauritius,21.08.2025,Recherche pour l’un de ses clients dans centre:Un commis de cuisineHoraires :Du lundi au dimanche avec un jour de repos par semaine (le mardi) de 14hrs30 à 23hrs30Avantages:Salaire de base de Rs 25 000Prime de présence de Rs 1 500Prime de Ponctualité de Rs 1 000Prime de Productivité de Rs 1 500Transport rembourséContrat en CDIMerci de nous envoyer votre CV sur recrutement@gml-mu.com ou au 5255 7740/5840 2010 par WhatsApp en précisant bien quel est le poste qui vous intéresse
