id,job_id,title,sector,employer,country,closing_date,summary
178,44694,"Technician, General",Trade,REY & LENFERNA,Mauritius,31.08.2025,"We have exciting opportunities for Technicians in different fields to join our dynamic team.  You will assist in conducting and executing support services such as the reparation, installation, maintenance and demonstration of related products and equipment within a reasonable time and to ensure quality service."
179,44692,Administrative Assistant,Manufacturing-Electronics & Electrical Products,FLUX LTD,Mauritius,31.07.2025,Administrative Officer
187,44369,Consultant,Consultancy Services,ECOSIS LTD,Mauritius,31.08.2025,"Assistant Sustainability consultantEcosis is a sustainability and social impact consultancy.Its mission is to co-create the World we want.It is founded on strong values of discipline,rigour,  continuous improvement and ethics.We are looking for an assistant sustainability consultant. The ideal candidate wants more than just a job; someone who wants to work for positive change. The candidate must be ready to take on responsibilities and an avid learner.Interested individuals to write a motivation letter as part of the application procedure + fill in the following form   https://forms.gle/1J512NE8TSqQsux58"
188,44367,Draughtsperson,Construction,METASIGN COMPANY LTD,Mauritius,31.08.2025,"We are seeking a skilled Draughtsperson with a strong background in civil and metal works to join our team. In addition to preparing detailed technical and fabrication drawings, the Draughtsperson will also oversee day-to-day activities in the workshop to ensure smooth operations, quality fabrication, and timely delivery of projects."
193,44273,Mason,Construction,METASIGN COMPANY LTD,Mauritius,31.12.2025,"We are seeking an experienced and skilled Mason to join our construction team. The ideal candidate will be responsible for laying bricks, concrete blocks, stones, and other building materials to construct or repair walls, partitions, arches, and other structures. A strong understanding of construction plans, precision in measurements, and commitment to safety are essential for success in this role."
194,44272,Helper,Construction,METASIGN COMPANY LTD,Mauritius,31.12.2025,We are hiring a dependable Mason Helper to assist masons in construction and maintenance projects.
195,44271,Helper,Construction,METASIGN COMPANY LTD,Mauritius,31.12.2025,We are looking for a reliable and hardworking Welder Helper to support our welding operations.
196,44270,"Welder, General",Construction,METASIGN COMPANY LTD,Mauritius,31.12.2025,"We are seeking a skilled and detail-oriented Welder to join our team. The ideal candidate will be responsible for assembling, repairing, and fabricating metal structures and components using various welding techniques such as MIG, TIG, and arc welding. The Welder must be able to read and interpret technical drawings, blueprints, and specifications to ensure high-quality and precise workmanship. A strong commitment to safety protocols and quality standards is essential in this role."
4584,44238,Administrative Assistant,Construction,SERVICE TECHNIQUE DU BATIMENT (STB) LTEE,Mauritius,31.08.2025,Filing paperworkAnswering phone callsPreparing documents for meetingsManaging supervisors’ calendarsOrganizing meetingsGreeting office visitorsComposing documentsHandling general office tasksDirecting communications between colleagues and customersEntering dataBookkeepingMaintaining office equipment
4589,44052,Driver-Messenger,Construction,SERVICE TECHNIQUE DU BATIMENT (STB) LTEE,Mauritius,31.08.2025,• Collect materials from stores and suppliers and deliver the materials on assigned sites.• Perform preventative and regular maintenance on lorries and ensure that vehicle fluids are sufficient.• Drive company vehicles to pick or drop employees.• Work overtime when needed to pick up workers from sites and drop them home.• Pick up/ drop employees to airport when needed.• Report any serious mechanical problems to the concerned individual within the company.• Supervise the loading of the vehicle so that goods are safely loaded and secured to minimise chances of damage.• Make-certain that all paperwork accompanying goods is complete.• Drive the vehicle safely and in accordance with the law.• Report any accidents as soon as possible and in compliance with the company’s accident reporting procedure.• Deliver important documents to required destinations.• Ensure that all deliveries have been signed and delivered to the correct recipient.• Follow a schedule to ensure timely delivery.• Keep vehicle clean and maintained at all times.• Other cognate duties as may be assigned by Management.
203,44049,Shop Assistant,Trade,ELECTRO HIVE LIMITED,Mauritius,01.10.2025,Sales Person in Electronic Gadget Shop
206,43894,"Driver, Bus",Travel & Tours,PERLE DU JOUR,Mauritius,05.09.2025,DRIVE PUBLIC BUS ALONG ROUTES AUTHORISED BY THE NATIONAL LAND TRANSPORT AUTHORITY (NLTA)
207,43877,"Driver, Truck/Goods Vehicle/Chauffeur Poid-Lourd",Entrepreneurship-Other Service activities,HYGIENE SOLUTIONS ( MAURITIUS) LTD,Mauritius,29.08.2025,Driver/storekeeper
212,43703,Administrative Assistant,Social Services,T1DIAMS,Mauritius,31.07.2025,"We got an amazing internship for you!We are looking for a dynamic Administrative Intern on YEP Scheme for 1 Year to work in our Administrative Department at T1 Diams, the NGO providing multidisciplinary support to people living with Type 1 diabetes in Mauritius and Rodrigues Island."
216,43565,Pumping Station Operator,"Electricity, Gas, Steam & Air Conditioning supply",KEWALPARSAD & CO LTD,Mauritius,31.12.2025,The job requires assisting customers by serving fuel and gas.
218,43495,"Plumber and Pipe Fitter, General",Construction,SOLVCON LIMITED,Mauritius,31.12.2025,Laying of pipes and fittingsPipe connectionsSewage connections
220,43346,Nursing Officer,Human Health & Social work activities,CITY CLINIC GROUP,Mauritius,31.10.2025,"A Nursing Officer is responsible for overseeing patient care, ensuring adherence to medical protocols, and supervising nursing staff. They coordinate healthcare services, maintain high standards of patient care, and support the management team in administrative and operational functions."
221,43329,"Driver, Private Car",Human Health & Social work activities,CITY CLINIC GROUP,Mauritius,31.10.2025,"The role involves transporting patients, staff, and medical supplies safely and efficiently. Candidates must hold a valid license, be skilled in driving manual transmission vehicles, and be capable of driving ambulances when required. Flexibility for shifts, including emergencies, is essential."
4610,43122,Custom Clerk,Transport and Storage,AQUALINE LOGISTICS LTD,Mauritius,31.07.2025,liaise with customs and excise officersliaise with ministries and other authorities as requiredliaise with customers and other stakeholders
4133,43104,Electrician,Manufacturing-Other,HOW HONG & CO LTD,Mauritius,31.08.2025,"Monitor and analyze electric systems.Repair Broken and Wiring Equipment.Test devices for improvement, safety and quality control."
226,42938,Aluminium Fabricator,Construction,AMF  MOHAMMAD  & SON  LTD,Mauritius,02.12.2025,aluminium fabricators
227,42915,Cashier,Human Health & Social work activities,CITY CLINIC GROUP,Mauritius,31.10.2025,"Ensuring smooth financial transactions within a healthcare facility. They manage payments, provide accurate billing, and deliver excellent customer service to patients, ensuring a positive experience in the clinic."
228,42914,Health Care Assistant,Human Health & Social work activities,CITY CLINIC GROUP,Mauritius,31.10.2025,"We are looking for a compassionate and dedicated Health Care Assistant to join our healthcare team. In this role, you will provide essential support to patients and medical staff, ensuring high-quality care and a positive patient experience."
229,42913,Receptionist,Human Health & Social work activities,CITY CLINIC GROUP,Mauritius,31.10.2025,"1.Greet patients and visitors with professionalism and warmth.2.Answer phone calls, respond to inquiries, and schedule appointments.3.Manage the clinic’s appointment system to minimize wait times."
230,42895,Debt Collector,BPO/ICT,IQERA INDIAN OCEAN,Mauritius,31.12.2025,Debt recovery
232,42878,CNC Milling and Lathe Machine Operator/Machiniste CNC,Manufacturing-Furniture,ATELIER DECO LTEE,Mauritius,31.07.2025,"1. Plans machining by studying work orders, blueprints, engineering plans, materials, and orthographic drawings.2. Takes inventory by checking stock to determine the amount available, anticipated stock, and placing orders.3. Programs mills and lathes by entering instructions, including zero and reference points.4. Sets-up mills and lathes by installing and adjusting three- and four-jaw chucks, tools, and attachments.5. Loads feed mechanism by lifting stock into position.6. Verifies settings by measuring positions, first-run part, and sample workpieces.7. Maintains specifications by observing drilling, grooving, and cutting, including turning, facing, knurling, and thread chasing operations.8. Maintains safe operations by adhering to safety procedures and regulations.9. Maintains equipment by completing preventive maintenance requirements.10. Maintains continuity among work shifts by documenting and communicating actions.11. Documents actions by completing production and quality logs.12. Updates job knowledge by participating in educational opportunities."
236,42820,Security Guard,Consultancy Services,CAREER MOVES,Mauritius,01.12.2025,"A Security Guard is responsible for maintaining a safe and secure environment by monitoring premises, preventing theft or vandalism, and ensuring the safety of people and property."
237,42812,Event Management Executive,Social Services,T1DIAMS,Mauritius,31.07.2025,"T1 Diams, the NGO providing multi-disciplinary support to people living with Type 1 diabetes in Mauritius and Rodrigues Island is looking for an Event Coordinator with 1 year of experience and excellent communication and event coordination skills."
239,42773,"Driver, Private Car",Construction,CIVELMEC GROUP LTD,Mauritius,31.07.2025,-Messenger
240,42760,Gardener,Administrative,GHYDRO BROS & SONS LTD,Mauritius,16.10.2025,We are looking for Gardener position for Ghydro Bros And sons ltd
595,42751,"Cook, Hotel/Restaurant",Human Health & Social work activities,RGT (HEALTHCARE) LTD,Mauritius,15.09.2025,Royal Green is looking for creative and energic Cooks to join its team of professionals assisting in food preparation.
242,42741,Field Crop Farmer,Administrative,GHYDRO BROS & SONS LTD,Mauritius,22.08.2025,We are looking for field crop skilled workers
243,42737,"Machine Operator, Bakery products",Manufacturing-Food Products & Beverages,ICE CREAM CONES LTD,Mauritius,01.11.2025,"I am currently seeking workers who are capable of operating machinery ,assembling products, and utilizing an industrial mixer, which will then be processed into finished products."
2438,42676,Human Resources Manager,Manufacturing-Other,PAPER CONVERTING CO. LTD,Mauritius,29.08.2025,"-To coordinate and direct the administrative functions of the organization.- Oversee recruitments, interviews & hiring new staffs- Consulting with top executives on strategic planning and serve as a link between the organization’s management & its employees.-Importation of Expatriates"
244,42663,Housekeeping Attendant,Human Health & Social work activities,CITY CLINIC GROUP,Mauritius,31.10.2025,"Cleaning, Sanitising, Disposing of waste, Laundering,"
3252,42570,Accounts clerk,Trade,METEX TRADING CO LTD,Mauritius,25.08.2025,"The Accounts Clerk will be responsible for managing financial transactions and maintaining accurate financial records. Key duties include processing invoices, reconciling accounts, preparing financial reports, and assisting with budgeting and audits. Strong attention to detail, proficiency in accounting software, and effective communication skills are essential. The role supports the accounting department in ensuring compliance with financial regulations and contributes to overall financial management within the organization."
603,42554,Laboratory Technician,Human Health & Social work activities,RGT (HEALTHCARE) LTD,Mauritius,15.09.2025,"Royal Green is looking for a skilled, experienced and motivated Lab Technician."
248,42507,Maintenance Officer,Agro-Industry,INICIA LTEE,Mauritius,31.01.2026,To maintain and repair equipment
249,42506,"Driver, Truck/Goods Vehicle/Chauffeur Poid-Lourd",Agro-Industry,INICIA LTEE,Mauritius,31.01.2026,Drive goods vehicle and promote products of the company
250,42505,"Farm Worker, Livestock",Agro-Industry,INICIA LTEE,Mauritius,31.01.2026,Take care of livestock
3257,42501,Logistic Officer,Trade,METEX TRADING CO LTD,Mauritius,25.08.2025,"We are looking for a detail-oriented Logistics Clerk to support our supply chain and transportation operations. The ideal candidate will be responsible for coordinating shipments, tracking inventory levels, and maintaining accurate records of logistics activities. This role involves processing shipping documents, communicating with carriers, and ensuring timely delivery of goods. Strong organizational skills, attention to detail, and proficiency in logistics software are essential. The Logistics Clerk will work closely with team members to optimize processes and enhance operational efficiency. Previous experience in logistics or supply chain management is preferred."
3258,42499,Receptionist,Trade,METEX TRADING CO LTD,Mauritius,25.08.2025,"We are looking for a professional and welcoming Receptionist to manage the front desk and serve as the first point of contact for our clients and visitors. The ideal candidate will be responsible for greeting guests, answering phone calls, handling inquiries, and performing administrative tasks such as scheduling appointments and maintaining records. Strong communication skills, attention to detail, and a friendly attitude are essential for creating a positive first impression. The candidate should be computer literate and proficient in using office software. Previous experience in a receptionist or administrative role is preferred. The Receptionist and customer care will also assist with coordinating office activities and supporting various departments as needed."
3259,42495,Warehouse Executive,Trade,METEX TRADING CO LTD,Mauritius,25.08.2025,"We are looking for a detail-oriented Warehouse Manager to oversee our warehouse operations and ensure efficient storage and distribution of goods. The ideal candidate will be responsible for managing inventory levels, optimizing warehouse layout, and leading a team of warehouse staff. This role includes implementing safety protocols, coordinating shipments, and maintaining accurate records of inventory and shipments. Strong leadership, organizational, and communication skills are essential, along with a commitment to improving processes and enhancing productivity. Previous experience in warehouse management is preferred."
3260,42494,Sales and Marketing Manager,Trade,METEX TRADING CO LTD,Mauritius,25.08.2025,"We are seeking a results-driven Sales Manager to lead our sales team and drive revenue growth. The ideal candidate will be responsible for developing and implementing effective sales strategies, setting sales targets, and managing performance to achieve company goals. This role involves training and mentoring team members, analysing market trends, and building strong relationships with clients. The Sales Manager will collaborate with marketing and product development teams to enhance sales efforts and ensure customer satisfaction. Strong leadership, communication, and analytical skills are essential for success in this role. Previous experience in sales management is preferred."
251,42448,Software Developer,Consultancy Services,SPHEREFLUX LTD,Mauritius,30.09.2025,"The ideal candidate will be responsible for developing high-quality applications. They will also be responsible for designing and implementing testable and scalable code.Development tools:1. Programming Language: PHP, Angular, Python, HTML/HTML5, CSS and Javascript2. Frameworks: YII FrameworkDatabase: MySQL, SQL Server3. Database: MySQL, SQL Server"
252,42417,Security Guard,"Arts, Entertainment and Recreation",PALLAGAMES LTD,Mauritius,08.10.2025,"Security guards ensure the safety and security of a company’s property, customers, and personnel. They investigate suspicious activity within their area of responsibility and may apprehend, eject, or report perpetrators."
253,42416,CCTV Supervisor,"Arts, Entertainment and Recreation",PALLAGAMES LTD,Mauritius,08.10.2025,"CCTV operators are responsible for monitoring security camera footage to detect and prevent vandalism, theft and other crimes. Their day-to-day tasks include maintaining equipment, storing footage, walking the premises, logging issues and reporting suspicious activity."
254,42415,Dealer,"Arts, Entertainment and Recreation",PALLAGAMES LTD,Mauritius,08.10.2025,"A Dealer is tasked with overseeing table games like poker and blackjack to ensure the rules are adhered to and the winnings properly distributed. Their duties include shuffling and distributing cards, managing casino chips and identifying and reporting cases of cheating."
255,42414,Cleaner,"Arts, Entertainment and Recreation",PALLAGAMES LTD,Mauritius,08.10.2025,"The Cleaner is responsible for cleaning, stocking, and supplying designated facility areas (dusting, sweeping, vacuuming, mopping, etc.). It is this person who will also perform deep cleaning tasks and special projects."
256,42413,Barman / Barmaid / Bartender,"Arts, Entertainment and Recreation",PALLAGAMES LTD,Mauritius,08.10.2025,"Their duties include verifying the identification and age of customers, preparing and serving alcoholic beverages, accepting payment from customers, cleaning glasses and bar utensils and balancing cash receipts to record sales."
257,42412,Accounts clerk,"Arts, Entertainment and Recreation",PALLAGAMES LTD,Mauritius,08.10.2025,"Account Clerks manage accounts and provide support for the accounting, finance and sales departments."
258,42363,Draughtsperson,Manufacturing-Metal Products,MRC WIRE PRODUCTS LTD,Mauritius,31.07.2025,Looking for potential candidate for the post of draughtsman with regard to below details.
259,42180,Administrative Assistant,Manufacturing-Other,FOODS WORTH CO LTD,Mauritius,31.07.2025,"Foods Worth Co Ltd (Maubon) is searching for an Administrative Assisant/Secretary, preferably with experience and residing in the South.Candidates should have good knowledge of manipulating Softwares (Windows), knowledge in managing Microsoft Office (Word, Excel, Powerpoint, etc..), emails and Management Softwares as Quickbooks would be a surplus."
260,42166,Room Attendant,Hotel,BAYSTONE BOUTIQUE HOTEL & SPA,Mauritius,31.08.2025,"Room Attendant makes sure guest rooms are clean and orderly.He/She upkeeps the overall impression of the hotel. *Must follow the hotel’s standards.*Besides cleaning rooms, check and report on items that are damaged, or are in need of repair.*Reply to guests in a polite manner, taking care of special requests or problems"
261,42150,Automobile Panel Beater,Engineering Services,GNK CO LTD,Mauritius,10.09.2025,Interract with the Garage ManagerProfessional in his jobDo it duties like a pro
262,42149,Automobile Painter,Engineering Services,GNK CO LTD,Mauritius,10.09.2025,Preparation of body panelsSanding & primer coatingPaintings workPolish & detailing works
266,42045,Waiter/Waitress,Hotel,BAYSTONE BOUTIQUE HOTEL & SPA,Mauritius,31.12.2025,Maintain positive guest interactions while accurately serving food and beverages to guests in a friendly and efficient manner.
267,42044,Cleaner,Hotel,BAYSTONE BOUTIQUE HOTEL & SPA,Mauritius,31.12.2025,"We’re looking for a meticulous and dedicated Hotel Steward to join our team.As a Hotel Steward, you will be responsible for maintaining cleanliness in various areas of the hotel, including kitchens, dining areas, and public spaces.The ideal candidate should have a keen eye for detail, strong organizational skills, and a commitment to upholding hygiene standards"
268,42043,Hotel Receptionist,Hotel,BAYSTONE BOUTIQUE HOTEL & SPA,Mauritius,31.12.2025,"Key Responsibilities of a Front of House Agent:Greeting and Welcoming Guests:They provide a warm welcome and create a positive first impression.Handling Check-Ins and Check-Outs:They manage the process of guests arriving and departing, ensuring efficiency and accuracy.Answering Guest Inquiries: They provide information about the hotel or restaurant, its amenities, and local attractions.Addressing Guest Concerns: They handle complaints and issues promptly and professionally.Managing Reservations: They may take reservations for rooms or tables, ensuring accurate bookings.Processing Payments: They handle cash transactions and other payment methods.Maintaining a Welcoming Atmosphere: They contribute to the overall ambiance of the front desk area.Collaboration with Other Departments: Work with other departments, like the housekeeping or event staff, to provide seamless service.Ensuring Guest Satisfaction: Their primary goal is to ensure guests have a positive experience and leave with a good impression."
625,41917,Trainee Engineer,Construction,KYA ENGINEERS LTD,Mauritius,31.08.2025,We are seeking a skilled and motivated Mechatronics Engineer and/or Mechanical Engineer to join our team. The ideal candidate will have a strong background in mechatronic systems design and implementation. You will work closely with our engineering team to develop and execute projects that meet client specifications and industry standards.
270,41797,Storekeeper,Human Health & Social work activities,CITY CLINIC GROUP,Mauritius,31.10.2025,"Ensure the reception, storage, dispatch and daily management of the stock of products marketed by the company.Ensure the conformity of products received and delivered.Ensure the management of inventories: control of the rotation of goods, verification of their availability, procurement from suppliers, tidying, cleaning, inventory.Keep a record of sales and restock.Maintain an automated supply inventory database.Replenish supply inventories following established guidelines."
271,41630,Trainee Land Surveyor,Administrative,"MINISTRY OF LABOUR, HUMAN RESOURCE DEVELOPMENT & TRAINING",Mauritius,31.12.2025,"To be enlisted as trainees, candidates should be holders of either a diploma in land surveying from the University of Mauritius or any prescribed qualification in land surveying in accordance with the Land Surveyors Act.  The trainees will undergo and complete, the period of two years’ practical training under the direct supervision of a Land Surveyor."
272,41629,Trainee Engineer,Administrative,"MINISTRY OF LABOUR, HUMAN RESOURCE DEVELOPMENT & TRAINING",Mauritius,31.12.2025,"To be eligible for enlistment as trainees, candidates should be holders of a degree in any Engineering fields, recognized by the Council of Registered Professional Engineers of Mauritius as qualifying for registration under Ordinance No. 49 of 1965, as amended by Ordinance No. 9 of 1967, and have to undergo, or complete, the period of two years’ practical training prescribed by the Council to qualify for registration under the above-mentioned Ordinance. Applicant shall produce an Eligibility Certificate (Stage1) from CRPE."
2470,41583,"Helper, Store",Manufacturing-Other,HOW HONG & CO LTD,Mauritius,31.08.2025,Will discuss during interview.
273,41538,Cashier,"Arts, Entertainment and Recreation",PALLAGAMES LTD,Mauritius,31.12.2025,"RESPONSIBILITIES- To handle money, cash chips, tokens- To honor valid receipts and vouchers- Effect payment when needed, deal with credit cards and foreign currency"
638,41275,Storekeeper,Construction,METASIGN COMPANY LTD,Mauritius,31.08.2025,"The storekeeper will be responsible for managing inventory, ensuring that supplies are stocked and monitored. He should be able to manage entry & exit of goods. Minimize losses and Maintain a smooth operation.No experience requiredTraining will be providedOvertime paid.Working Hour:6:45 - 16:456:45 - 12:00 SatSalary negociableCall on 52593356 or Send your CV on hr@metasign.mu"
2485,39845,Welder,Manufacturing-Other,WINDOORS PROFESSIONAL LTD,Mauritius,31.10.2025,Job brief:We are looking for a skilled Welder to cut and join metals and other materials at our facilities or construction sites. You will operate appropriate equipment to put together mechanical structures or parts with a great deal of precision. Your job is important as it provides the foundation for strong infrastructure.A welder must be competent in using potentially dangerous equipment following all safety precautions. The ideal candidate will also have a steady hand and great attention to detail. Knowledge of different kinds of metal and their properties is essential.
287,39272,Cashier,Restaurant,RPM LTD,Mauritius,30.09.2025,Cashier
288,39120,Software Developer,BPO/ICT,APHELION LIMITED,Mauritius,17.10.2025,"We are seeking a Power BI and skilled SQL Developer to join our dynamic team in the systems integration sector. The ideal candidate will have experience in data visualization, report creation, and application development to enhance our business intelligence capabilities and streamline our processes."
290,38851,Chef de Partie,Restaurant,RPM LTD,Mauritius,30.09.2025,Chef de Partie
291,38850,Cook (Italian Cuisine and Pastry)-Placement & Training,Restaurant,RPM LTD,Mauritius,30.09.2025,cook
292,38849,Barman / Barmaid / Bartender,Restaurant,RPM LTD,Mauritius,30.09.2025,Barman
293,38848,Chef cuisinier,Restaurant,RPM LTD,Mauritius,30.09.2025,Chef / Sous chef
294,38847,Waiter/Waitress,Restaurant,RPM LTD,Mauritius,30.09.2025,Waiter / Waitress
