id,job_id,title,sector,employer,country,closing_date,summary
231,42885,Storekeeper,Manufacturing-Furniture,ATELIER DECO LTEE,Mauritius,31.07.2025,"Ensure security, maintenance and control of the storeHandle all administrative tasks related to stockAssist in the loading and unloading of goodsEnsure that inventories are held and managed effectivelyVerify and approve invoices during dispatch at all timesHealth & Safety and work ethics"
234,42854,"Cook, Hotel/Restaurant",Hotel,BAYSTONE BOUTIQUE HOTEL & SPA,Mauritius,31.07.2025,"This vacant post requires a candidate with proficiency in both French gastronomy and the Mauritian cuisine.The role necessitates a strong culinary background, including expertise in classic French dishes and a deep understanding of the unique flavors and ingredients of Mauritian cuisine."
238,42805,"Carer, Home",Human Health & Social work activities,RGT (HEALTHCARE) LTD,Mauritius,31.07.2025,"The Nursing Home Attendant is someone responsible for assisting in care and personal support of patients / Residents as well as in charge of patient’s room hygiene and cleanliness according to internal procedures. The NHA should also assist patients in the basic needs like getting up, bathing, dressing, toileting, eating and others as well as to assist the Medical Nursing Staffs in their duty when required. The NHA should ensure the patients are satisfied with services they receive."
246,42639,Beauty and skin Commercial Advisor,Trade,IBL LTD (BRANDACTIV),Mauritius,31.07.2025,"Beauty Advisor is to offer beauty advice, provide product demonstration , sell products and handle cash register."
263,42135,Store and Stock Controller,Construction,SKY TOUCH CONSTRUCTION AND RENOVATION LTD,Mauritius,31.07.2025,To be advise
265,42076,Safety and Health Officer,Construction,SERVENG LIMITED,Mauritius,31.07.2025,Registered Dedicated & experienced registered safety & Health officer to join our team in compliance with section 30 of the OSHA.Occupational safety & health auditspreventive measuresAdvisory roleTraining programsOn-the-job trainingSafety recommendations
269,41905,Upholsterer/Garnisseur,Manufacturing-Furniture,ATELIER DECO LTEE,Mauritius,31.07.2025,Chairs/Sofa Reparation
277,41444,Kitchen Assistant,Human Health & Social work activities,CITY CLINIC GROUP,Mauritius,31.07.2025,"Slicing, cutting meat/fish/chicken/vegetables into portions and cleaning the kitchen. Wash the refrigerators, tables, utensils, cabinets and other items used in the kitchen for food preparation"
278,41308,Procurement/Purchasing Officer,Construction,SKY TOUCH CONSTRUCTION AND RENOVATION LTD,Mauritius,31.07.2025,"Procurement Officer will be responsible to evaluate and supply material, maintaining relationships, approving products, and ensuring the cost-effective procurement of materials, parts, or goods."
279,41306,Site Engineer,Construction,SKY TOUCH CONSTRUCTION AND RENOVATION LTD,Mauritius,31.07.2025,A. Possess leadership qualities / good Management Practices and be a good Communicator.B. Must be able to read / understand and correctly interprete Plans / Drawings / BOQ.C. Must be able to calculate and order materials required as per Plans / Drawings / BOQ.D. Must be well versed with Technical Specifications and latest Construction Materials available on the market.
280,41305,Site Manager,Construction,SKY TOUCH CONSTRUCTION AND RENOVATION LTD,Mauritius,31.07.2025,You will be required to be in charge and supervise for the proper running of various sites of works of the Company at a time.
281,40876,"Engineer, Sustainable Development",Consultancy Services,ECOSIS LTD,Mauritius,31.07.2025,"Assistant sustainability and social impact consultantEcosis is a sustainability and social impact consultancy.Its mission is to co-create the World we want.It is founded on strong values of discipline,rigour,  continuous improvement and ethics.We are looking for an assistant sustainability consultant. The ideal candidate wants more than just a job; someone who wants to work for positive change. The candidate must be ready to take on responsibilities and an avid learner.Interested individuals to write a motivation letter as part of the application procedure."
282,40778,Employé des rayons/Shelves Worker,Trade,SOFLO DISTRIBUTION LTD,Mauritius,31.07.2025,1.  Ensure that all shelves are in good conditions before opening of shop.2. Remove empty boxes and cases.3. Case updated price in all products.4. Fill shelves as and when required.5. Close follow up on expiry date of all items.6. Monitor inventory.
283,40777,Cashier,Trade,SOFLO DISTRIBUTION LTD,Mauritius,31.07.2025,"1. Scanning items and explaining any changes in price to customers.2. Performing basic maths function to collect payments and give change.3. Handling exchanges and refunds in a quick, efficient manner.4. Balancing the till at the end of the day and maintaining accurate cash drawer.5.  Asking customers about their shopping experience.6. Processing coupons and vouchers.7. Keeping the checkout area clean and orderly."
284,40775,"Helper, Store",Trade,SOFLO DISTRIBUTION LTD,Mauritius,31.07.2025,Provide service in various tasks.
285,40770,Helper,Manufacturing-Other,BAGATELLE DISTRIBUTION LTD,Mauritius,31.07.2025,Provide support in various tasks.
289,38886,Bakery Operator,Trade,SOFLO DISTRIBUTION LTD,Mauritius,31.07.2025,"Baking various types of bread and other bakery products in large batches. ... Wrapping, slicing, and packaging bread products. Decorating, slicing and wrapping finished products. Cleaning machinery and work station."
296,37413,Helper,Trade,ASSOCIATED COMMERCIAL CO LTD,Mauritius,31.07.2025,We are recruiting helpers to work in the our tyre/battery centre
302,34381,Painter,Repair and installation of machinery & equipment,GARAGE SILCA LTD,Mauritius,31.07.2025,Car painter
303,34380,Panel Beater,Repair and installation of machinery & equipment,GARAGE SILCA LTD,Mauritius,31.07.2025,Panel beating
304,34379,"Mechanic, Motor Vehicle",Repair and installation of machinery & equipment,GARAGE SILCA LTD,Mauritius,31.07.2025,Professional Petrol/diesel mechanics
305,34184,Storekeeper,Trade,LOVELY HOME LTD,Mauritius,31.07.2025,"We’re looking for a detail-oriented and organized individual to support both operational and administrative tasks within our Hardware/Materials Department. You’ll play a key role in inventory management, order processing, and customer service."
308,32305,Machine Operators,Printing,PRECIGRAPH LTD,Mauritius,05.08.2025,"MISSIONPrécigraph est une entreprise expérimentée qui propose des services d’arts graphiques depuis 1973.Notre personnel qualifié et notre parc de machines garantissent des produits et des services à forte valeur ajoutée permettant à nos clients nationaux et internationaux de promouvoir efficacement leur image.VISIONPassionnés de précision, déterminés à repousser nos limites et engagés à servir afin de contribuer en équipe au succès durable de nos partenaires.VALEURSNotre mission et notre vision reposent sur ces 5 valeurs :PrécisionRéactivitéEnthousiasmeCaringIntégrité"
309,30782,"Driver, Truck/Goods Vehicle/Chauffeur Poid-Lourd",Trade,ASSOCIATED COMMERCIAL CO LTD,Mauritius,31.07.2025,Goods vehicle driver
312,30103,Watchman,Transport and Storage,MS WAREHOUSING AND LOGISTICS LTD,Mauritius,31.07.2025,"1. To secure premises and personnel by patrolling property; monitoring surveillance, inspecting buildings, equipment, and access points; etc..2. Respond to queries, and provide information to visitors/ Clients as and when required3. To call relevant Authorities in cases of emergency, such as fire or presence of unauthorized persons.If you feel you have the qualities, drop your CV on the following Email Address or call on 52569330.Email Address: adaroga@mswl.mu"
313,30038,Storekeeper,Trade,ASSOCIATED COMMERCIAL CO LTD,Mauritius,31.07.2025,"We are looking for a dynamic person to join our warehousing and logistics team , must be a team player"
314,29956,Garage Supervisor,Trade,ASSOCIATED COMMERCIAL CO LTD,Mauritius,31.07.2025,"We are looking for a dynamic garage and technical  supervisor with experience in the tyre, wheel alignment and battery business to join our teamReporting to the officer in Charge"
316,29691,Interior Designer,Trade,LOVELY HOME LTD,Mauritius,31.07.2025,"The Interior Designer will create functional, safe, and aesthetically pleasing spaces by assessing space requirements, determining optimal furniture placement, and selecting decorative items, all while adhering to relevant blueprint, building code, and inspection requirements."
317,29631,"Driver, Van, Light and Local Transport",Trade,ASSOCIATED COMMERCIAL CO LTD,Mauritius,31.07.2025,Driver 2.5 tons
319,29368,Tyreman/Tyre Fitment Technician,Trade,ASSOCIATED COMMERCIAL CO LTD,Mauritius,31.07.2025,Tyreman
320,26975,"Driver, Truck/Goods Vehicle/Chauffeur Poid-Lourd",Manufacturing-Food Products & Beverages,FOOD CANNERS LTD,Mauritius,31.07.2025,Transfer of goods through various warehouses and local purchases.
328,6349,Graphic Designer,Trade,LOVELY HOME LTD,Mauritius,31.07.2025,"Design fresh, new and eye-catching consistent graphic solutions to communicate the brand message in all print, digital and video related avenues."
329,1159,"Driver, Private Car",Transport and Storage,RAMPHUL ENTERPRISE,Mauritius,31.07.2025,VAN DRIVER
334,45308,Client Administrator,BPO/ICT,INTERNATIONAL SOS AFRICAN SERVICES LTD,Mauritius,11.08.2025,"The Client Services Intern will provide consistent support to the Africa Regional and Cluster Sales Teams in relation to tracking project related expenses, the timely and accurate invoicing to clients and ad hoc project support."
335,45307,"Handyman, Building Maintenance",Manufacturing-Other,INNODIS LTD,Mauritius,07.08.2025,"The Handyman provides general maintenance support across the facility, ensuring a clean, safe, and functional environment that meets the operational needs of dairy manufacturing. The role includes minor repair work, basic plumbing and electrical fixes, small-scale installation tasks, and upkeep of both indoor and outdoor areas. Reporting to the technical or maintenance supervisor, this position plays a vital role in supporting production readiness and workplace hygiene."
338,45304,Maintenance Technician,Manufacturing-Other,INNODIS LTD,Mauritius,07.08.2025,"We are seeking a hands-on and motivated Maintenance Mechanic to join our team in the dairy manufacturing plant. The successful candidate will be responsible for troubleshooting, repairing, and maintaining processing and packaging equipment to ensure seamless operations. This role plays a key part in supporting both preventive and corrective maintenance activities while contributing to the installation of new machinery.You’ll work closely with the engineering and production teams, gaining valuable experience in a fast-paced food manufacturing environment that prioritizes quality, safety, and continuous improvement."
345,45297,Tile Setter/Marble Layer,Construction,"B.L. HARBERT INTERNATIONAL, L.L.C",Mauritius,31.07.2025,Laying of Tiles
346,45296,Welder Tig/ Mig,Construction,"B.L. HARBERT INTERNATIONAL, L.L.C",Mauritius,31.07.2025,"• Secure and fasten structural components using clamps, braces, jacks and bolt straps• Carry out post-welding treatment of structures by cleaning, buffing and polishing finished work pieces• Inspect and evaluate welds to ensure they are free of defect and conform to set specifications• Conduct estimates to determine the cost of materials required for a welding project• Employ appropriate welding methods in completing structural fabrications• Utilize manual and mechanical processes to weld in various positions• Carry out welding operations under conditions such as extreme heights, confined spaces and inclement weather• Troubleshoot structures to identify and initiate repair of welding defects• Fit and weld metal components for pipelines, boilers, tanks and structural steel"
349,45293,Store Clerk,BPO/ICT,JACEY COMPUTER SYSTEMS LTD,Mauritius,31.07.2025,Storekeeper
350,45292,Health and Safety Officer,Administrative,KALIS INVESTMENT LTD,Mauritius,31.07.2025,"Diploma or Degree in Occupational Health and Safety (or equivalent qualification)-Proven experience in a similar role-Must have a valid driving licence and own vehicle-Strong knowledge of local H&S laws and regulations-Excellent communication and reporting skills-Ability to work independently and travel between sites when neededMain Responsibilities:-Conduct regular risk assessments and site inspections-Ensure compliance with health, safety, and environmental standards-Deliver training and awareness sessions-Investigate incidents and recommend corrective actions-Prepare and maintain H&S reports and documentation-Any other cognate dutiesIf you meet the criteria and are passionate about creating safe and compliant work environments, we would love to hear from you!To apply, please send your CV to deepmala.ramsurrun@kalisia.net or call on 213 0711."
351,45291,Steward / Stewarding Technician,Hotel,MARITIM RESORT & SPA MAURITIUS,Mauritius,31.07.2025,"Responsible for maintaining cleanliness in various areas of the hotel including kitchen, restaurant areas"
352,45290,"Cook / Chef, General",Hotel,MARITIM RESORT & SPA MAURITIUS,Mauritius,31.07.2025,"Duties will include preparing ingredients, adhering to set menu, and following food health and safety procedures."
365,45277,Administrative Assistant,Banking & Finance,ALLIANCE RISK SOLUTIONS LTD,Mauritius,31.07.2025,• Attend to phone calls• Opening of new files for clients and maintain filing system• Keep contact details updated• Handling of queries received from clients and insurance provider• Process and finalize insurance policies• Quality check of new contracts before it is dispatched• Assist with outstanding administration enquiries• Preparing invoices/Collecting insurance premiums/Issue receipts• Keeping detailed computer records• Renewing or amending existing policies for clients• Data input to generate reports on daily/weekly/monthly basis• Follow up of Claims/Renewals with regular updates to clients• Follow up of Outstanding Premium/Debtors• Undertake general office administrative duties• Any other cognate duties
366,45276,Software Developer,Manufacture - Medical Products and Equipment,ENVASTE LTD,Mauritius,04.08.2025,"ERPNext/Python Developer :We are looking for experienced candidates who have good experience in the Frappe framework/Erpnext as a developer. Who can help the company to transform its business using ERPNext and business process automation technologies.Job summary :Design, Configure, Build, Test, Deploy and Maintain ERPNext and Frappe based applications.Customize ERPNext modules based on business requirements.Implement data migration strategies.Lead ERPNext implementation projects."
495,45009,Driver-Messenger,BPO/ICT,JACEY COMPUTER SYSTEMS LTD,Mauritius,31.07.2025,DriverMessengerHelper
535,44594,Accounts clerk,E-Commerce,TERRY STORE,Mauritius,31.07.2025,We are looking to recruit 3 experienced accounts clerks to work across our group of companiesRemuneration is negotiable based on the skillset and experience you bring to the role
546,44336,Administrative Associate,Telecommunication,ASH HI TECH MOBILE CO LTD,Mauritius,31.07.2025,"Overseeing routine and advanced duties for other professionals.Organizing files, creating correspondence, and preparing reports or documents.Managing calendars, sorting mail, and preparing invoices.Handling general office tasks and administrative duties."
644,40728,Store and Stock Controller,Telecommunication,ASH HI TECH MOBILE CO LTD,Mauritius,31.07.2025,"Forecast supply and demand to prevent overstocking and running out-of-stock (OOS)Enter purchase details (vendors information, invoices and pricing) into internal databasesPlace orders to replenish merchandise as neededEvaluate suppliers’ offers and negotiate profitable dealsCoordinate regular inventory auditsLiaise with warehouse staff and other internal teams to test products’ quality (status upon delivery and storage conditions)Keep updated inventory records (including daily shipments)"
661,34985,Technical Operator,Manufacturing-Other,INNODIS LTD,Mauritius,07.08.2025,"Support refrigeration, boiler and air systemsAssist in utilities maintenance"
681,26963,Electromechanic,Manufacturing-Other,INNODIS LTD,Mauritius,07.08.2025,"The Electromechanical Technician is responsible for maintaining and troubleshooting automated production equipment to ensure continuous and reliable operation. This role involves working closely with internal teams and external machine suppliers, supporting improvement initiatives, and managing critical spare parts stock. You’ll also assist in fine-tuning equipment and advancing factory automation projects in a dynamic, food-grade production environment."
690,2552,Receptionist,Hotel,MARITIM RESORT & SPA MAURITIUS,Mauritius,31.07.2025,"•Deliver friendly, efficient customer service to create a warm and welcoming atmosphere for all our guests.•Manage cashiering at the reception.•Pay attention to special request with a pleasant and professional approach.•Answer to calls as well as take and relay telephone messages for guests.•Prepare bills, take payments, handle checkouts and process foreign exchange payment.•Communicate efficiently with housekeeping and maintenance staff to ensure quality service to guests.•Assist in keeping the hotel reception area clean and tidy at all times."
691,2496,Cabinet Maker/Menuisier,Hotel,MARITIM RESORT & SPA MAURITIUS,Mauritius,31.07.2025,"Responsible for constructing and repairing structures made of wood, plywood and other materials"
692,1573,Frigorist,Hotel,MARITIM RESORT & SPA MAURITIUS,Mauritius,31.07.2025,"Perform highly diversified duties to install, troubleshoot, repair and maintain production and facility equipment according to safety, predictive and preventive maintenance"
693,1403,Electrician,Hotel,MARITIM RESORT & SPA MAURITIUS,Mauritius,31.07.2025,"Diagnose and troubleshoot electrical issues, identifying the root causes and implementing necessary repairs promptly."
694,1377,Spa Therapist,Hotel,MARITIM RESORT & SPA MAURITIUS,Mauritius,31.07.2025,- Certificate in beauty care and therapy- Minimum 1 year of experience- Excellent communication skills- Pleasant and outgoing personality- Ability to work under pressure
2151,45355,Welder,Manufacturing-Other,SOCIETE DES TUBES ET RACCORDS MARKETING LTEE,Mauritius,31.07.2025,To assist the Company for welding of all metal racks and for general work purpose
2152,45354,Factory Worker,Manufacturing-Food Products & Beverages,ESKO & CO. LTD,Mauritius,31.07.2025,Working in food production
2165,45341,Pastry Chef,Restaurant,PRIME LEISURE AND RECREATIONAL LTD,Mauritius,31.07.2025,Assisting in the preparation and production of various pastries and desserts
2166,45340,"Commis, Kitchen",Restaurant,PRIME LEISURE AND RECREATIONAL LTD,Mauritius,31.07.2025,Food Preparation
2168,45338,Web Developer-Junior,Travel & Tours,HASHTAG HOLIDAYS DMC,Mauritius,31.07.2025,"We are looking for a Junior Web Developer with a strong interest in backend development using native PHP to join our tech team. You will work closely with the CTO to support the development and maintenance of custom web applications and platforms. This is a hands-on role ideal for a motivated individual looking to grow under the guidance of an experienced technical leader.Key Responsibilities:Develop, test, and maintain web applications using native PHPAssist in integrating APIs, building backend logic, and database queries (MySQL)Collaborate with the CTO on technical specifications and development tasksWork on front-end integration using HTML, CSS, and JavaScript when neededParticipate in code reviews and quality assuranceContribute to debugging, maintenance, and continuous improvementsRequired Skills:Proficient in PHP (native) and basic understanding of MySQLFamiliarity with HTML, CSS, JavaScriptEager to learn and grow in a fast-paced, real-world environmentAbility to follow instructions, document work, and meet deadlinesBasic knowledge of version control (Git) is a plusProfile:Degree or diploma in Web Development, Computer Science, or related field3 years of experience minimumPassionate about clean, efficient code and problem-solvingWillingness to collaborate and take feedback from the CTO and tech team"
2169,45337,Assistant Accountant,Manufacturing-Food Products & Beverages,IBRAHIM GOLAUP & CO LTD,Mauritius,31.07.2025,Assist the Accountant in finance Department
2171,45335,Telesales Representative,Travel & Tours,HASHTAG HOLIDAYS DMC,Mauritius,31.07.2025,"Sommaire : Le Travail de Télémarketing / Agent de TéléventeIntroductionDéfinition du télémarketingRôle d’un agent de téléventeImportance dans la stratégie commercialeMissions principalesProspection téléphonique (clients potentiels)Vente de produits ou services par téléphonePrise de rendez-vous pour les commerciauxSuivi client et relanceMise à jour de la base de données clientsCompétences requisesExcellente communication oralePersuasion et sens commercialMaîtrise des outils informatiques (CRM, logiciels d’appel)Gestion du stress et persévéranceÉcoute active et empathieConditions de travailTravail en centre d’appels ou à distance (télétravail)Horaires souvent flexibles ou en rotationTravail basé sur des objectifs/chiffresAvantages et défisAvantages : rémunérations variables (primes), expérience en vente, travail accessibleDéfis : refus fréquents, pression sur les résultats, travail répétitifFormation et évolutionPas toujours de diplôme requis, mais BTS en vente ou communication appréciéPossibilités d’évolution : superviseur, formateur, responsable d’équipe, commercial terrainConclusionMétier dynamique, essentiel pour la croissance commercialeOpportunités variées dans divers secteurs (assurance, énergie, télécom, tourisme…)"
2176,45330,Administrative and Human Resource Executive,Landscaping and Horticultural Services,EARTHSCAPE (MAURITIUS) LIMITED,Mauritius,31.07.2025,We are currently looking for a detail-oriented and experienced Secretary/HR Admin to join our team.The ideal candidate will have hands-on experience to support the day-to-day activities of our Human Resources department.
2177,45329,Receptionist,Administrative,GRAMMONT MANAGEMENT LTD,Mauritius,31.07.2025,"The position of receptionist consists of answering inquiries and obtaining information for the general public, customers, visitors and other interested parties. It also provides information regarding activities conducted at the establishment, location of departments, offices and employees within the organisation."
2181,45325,Pastry Chef,Management Consultancy Activities,GWENS PROPERTIES LTD,Mauritius,09.08.2025,"Recherche pour l’un de ses clients dans le Nord:Un commis PâtissierCompétences requises :Très bonne présentationExpérience au même poste obligatoireCapacité d’être indépendant et rapidePersonne responsable, ponctuelle et organiséeAvantages :Salaire de Rs 22,000 incluant prime de présenceTransport aller-retour prise en charge ou rembourséeHeures supplémentaires rémunérées et contrat en CDIDimanche payé selon la loi du travailHoraires :Du lundi au dimanche de 1h30 am à 8h30 am1 jour de congé par semaine (selon planning)Merci de nous envoyer votre CV sur recrutement@gml-mu.com ou au 52557740/58402010 par WhatsApp en précisant bien quel est le poste qui vous intéresse"
2182,45324,"Commis, Kitchen",Management Consultancy Activities,GWENS PROPERTIES LTD,Mauritius,09.08.2025,"Recherche pour l’un de ses clients dans le Nord:Un commis de cuisineCompétences requises :Très bonne présentationExpérience au même poste obligatoireCapacité d’être indépendant et rapidePersonne responsable, ponctuelle et organiséeAvantages :Salaire de Rs 24,000 incluant prime de présenceTransport aller-retour prise en charge ou rembourséeHeures supplémentaires rémunérées et contrat en CDIDimanche payé selon la loi du travailHoraires :Du lundi au dimanche de 5h00 du matin à 12h301 jour de congé par semaine (selon planning)Merci de nous envoyer votre CV sur recrutement@gml-mu.com ou au 52557740/58402010 par WhatsApp en précisant bien quel est le poste qui vous intéresse."
2184,45322,Maid,Private Household,UMME WARDAH JHAKRI,Mauritius,31.07.2025,"We are looking for a reliable and experienced Maid/Housekeeper to help maintain a clean, organized, and comfortable living or working environment."
2185,45321,"Cook, General",Restaurant,PRIME LEISURE AND RECREATIONAL LTD,Mauritius,31.07.2025,"Preparing and cooking food according to recipe and established standard ,while maintaining a safe and clean environment"
2186,45320,Accounts clerk,Restaurant,PRIME LEISURE AND RECREATIONAL LTD,Mauritius,31.07.2025,Performs a variety of clerical and bookkeeping tasks to support the organization’s financial operation
2187,45319,Technical Officer,Engineering Services,MEGA DESIGN LTD,Mauritius,18.08.2025,Autocad competence and site inspection experience
2190,45316,Maid,Private Household,PILLY MOOTANAH DHAYENDRA,Mauritius,31.07.2025,"? Clean the house and take care of everything in the house? Assists their employers with any repairs in the home? Takes the children to school or extra class if they required.? Keeps the property safe, secure, and clean for the family? Clean the yard and maintain it in good condition.? Doing small repairs like fixing any leaks, change bulbs, paint faded walls."
