id,job_id,title,sector,employer,country,closing_date,summary
123,45094,"Commis, Kitchen",Hotel,RIU LE MORNE,Mauritius,31.07.2025,"Join Our Global Family at RIU Hotels & Resorts!With over 100 hotels in 20+ countries and more than 70 years of hospitality excellence, RIU Hotels & Resorts is a global leader known for exceptional service, innovation, and warm hospitality. In June 2024, we proudly opened RIU Turquoise and RIU Palace Mauritius, forming the largest hotel cluster in Mauritius on the iconic Le Morne Brabant peninsula.Join us as we continue to redefine luxury and excellence. Whether you’re seeking to grow your career, explore new horizons, or work with a dynamic, inclusive team, RIU Turquoise and RIU Palace Mauritius offer unparalleled opportunities to thrive.Position: Commis IIDepartment: Kitchen???? About the RoleAs a Commis II, you will support the culinary team in creating outstanding dishes and ensuring smooth kitchen operations. This role is ideal for individuals with some culinary experience who are ready to take the next step in their career and work in a vibrant, world-class environment.???? What You’ll DoAssist in food preparation and cooking tasks with minimal supervision from senior chefs.Ensure all ingredients are prepared and ready for use, contributing to seamless kitchen workflows.Monitor food quality and presentation to maintain RIU’s high standards.Maintain cleanliness and organization of your workstation and kitchen areas.?? What We’re Looking ForPrior experience in a professional kitchen, with basic culinary training preferred.A strong passion for cooking and a commitment to continuous learning.???? What You’ll GetAttractive Remuneration Package and Bonuses: Enjoy a competitive salary and bonuses as part of our commitment to rewarding your work.Access to Company Healthcare: After completing one year of service, you’ll gain access to healthcare coverage, with 50% of the cost covered by the company.Efficient Staff Transport: We provide reliable and efficient transport options for all employees to ensure a stress-free commute.Nutritive Meals While on Duty: Enjoy well-balanced, nutritious meals to keep you energized during your work hours.Special Discounts: Benefit from exclusive discounts at all RIU Hotels & Resorts worldwide, giving you the opportunity to explore our global properties.???? Why RIU Hotels & Resorts?Your Growth is Our Priority: At RIU Hotels & Resorts, we believe in nurturing talent from within. We are proud to provide our team members with opportunities to advance their careers through training, mentorship, and internal promotions, ensuring your potential is recognized and rewarded—whether locally or internationally.A Culture of Belonging: Join a team where your ideas and efforts truly matter. We foster an inclusive, collaborative environment where every voice is heard, and success is celebrated together.Rewarding Your Commitment: Enjoy a career with competitive compensation, employee benefits, and perks that reflect our appreciation for your dedication and excellence.???? Our CommitmentAt RIU Hotels & Resorts, we value diversity, equity, and inclusion as fundamental pillars of our success. We welcome all applications, regardless of gender, ethnicity, religion, disability, age, sexual orientation, or gender identity. We believe that a diverse team enriches our culture and drives excellence in service.Additionally, we are firmly committed to sustainability and social responsibility. Through our Proudly Committed strategy, we place sustainability at the heart of all our decisions. This program reflects our dedication to minimizing environmental impact, promoting responsible practices, and making a positive contribution to the communities where we operate.By joining RIU, you will become part of a company that not only strives for service excellence but also aims to create a positive impact on the world."
125,45071,Compliance Officer,BPO/ICT,IQERA INDIAN OCEAN,Mauritius,31.07.2025,"Supervise and support the local compliance team.Define priorities, allocate tasks, monitor progress, and ensure team development."
126,45070,IT Manager,BPO/ICT,IQERA INDIAN OCEAN,Mauritius,31.07.2025,"Supervise the local team, plan the team’s work, and organize priority management."
127,45068,Recruiter,BPO/ICT,IQERA INDIAN OCEAN,Mauritius,31.07.2025,"Manage advertisements, in collaboration with the Recruitment Coordinator"
128,45067,IT Support Officer,BPO/ICT,IQERA INDIAN OCEAN,Mauritius,31.07.2025,"Collect user requests via ticketing system, phone or directly."
133,45044,"Driver, Van, Light and Local Transport",Trade,LOVELY HOME LTD,Mauritius,31.07.2025,"Are you a responsible and reliable driver with experience in stock handling? Do you have a valid Goods Vehicle License and a clean record? If yes, Lovely Home Limited is looking for you!"
136,45037,Upholsterer/Garnisseur,Manufacturing-Other,HORIZONBLEND COMPANY LTD,Mauritius,30.07.2025,"We are looking for a reliable and skilled Upholsterer to join our company.Location: Royal Road, Bramsthan, Central FlacqYou will work mainly on restoring car interiors and repairing existing furniture upholstery. We do not build furniture from scratch - we restore and reupholster existing pieces."
137,45033,Tourist Guide,Sports and Leisure,BLUE SUBMARINE LTD,Mauritius,31.07.2025,"SUBMARINE PILOTWe are seeking a skilled and safety-conscious Tourist Submarine Pilot Apprentice to learn how  operate and navigate our passenger submarine for underwater tours.The ideal candidate will ensure a safe, informative, and enjoyable experience for all guests while maintaining the highest standards of marine operations and customer service."
139,45027,Helper,Manufacturing-Jewellery,SHOBHA JEWELS,Mauritius,31.07.2025,Provide overall assitant in the company
141,45008,"Helper, Store",Trade,EXPRESS MART LTD,Mauritius,31.07.2025,"• Assist customers with locating products and answering queries.• Restock shelves and ensure products are organized and displayed correctly.• Maintain store cleanliness by sweeping, mopping, and dusting as needed.• Help in unloading deliveries and organizing stock in storage areas.• Ensure price tags are accurate and up to date.• Assist with inventory counts and reporting discrepancies.• Support sales staff during peak hours to manage customer flow."
142,44995,Watchman,Transport and Storage,MS WAREHOUSING AND LOGISTICS LTD,Mauritius,31.07.2025,"1. To secure premises and personnel by patrolling property; monitoring surveillance, inspecting buildings, equipment, and access points; etc..2. Respond to queries, and provide information to visitors/ Clients as and when required3. To call relevant Authorities in cases of emergency, such as fire or presence of unauthorized persons.If you feel you have the qualities, drop your CV on the following Email Address or call on 52569330.Email Address: adaroga@mswl.mu"
143,44994,"Driver, Private Car",Construction,KYA ENGINEERS LTD,Mauritius,31.07.2025,"We are looking for a dependable and professional Personal Driver with a minimum of 5 years of experience in a similar role. The successful candidate will be responsible for transporting the employer safely and punctually to various destinations, maintaining the vehicle in excellent condition, and ensuring discretion and confidentiality at all times. The role requires a high level of reliability, road safety awareness, and a courteous attitude."
152,44952,"Helper, Store",Trade,CHONG & SONS DISTRIBUTION LTD,Mauritius,31.07.2025,"We are seeking a hardworking and reliable warehouse helper to assist with day-to-day operations in our warehouse. The ideal candidate will be physically fit, detail-oriented, and able to work efficiently in a fast-paced environment. This role involves handling, moving, and organizing stock, as well as ensuring the warehouse remains clean, safe, and well-organized."
153,44951,"Driver, Truck/Goods Vehicle/Chauffeur Poid-Lourd",Trade,CHONG & SONS DISTRIBUTION LTD,Mauritius,31.07.2025,"We are looking for a responsible, experienced, and safety-conscious driver to join our team. The ideal candidate will have a clean driving record, strong knowledge of local routes, and a professional attitude. This role involves transporting goods, company staff, safely and efficiently, ensuring the vehicle is well-maintained at all times."
157,44939,Accounts clerk,Trade,SIMELEC LTÉE,Mauritius,31.07.2025,"Manage transactions, reports, and files. They also handle payments and administrative tasks to ensure smooth operations, Payroll,"
159,44934,Interior Designer,Manufacturing-Furniture,ATELIER DECO LTEE,Mauritius,31.07.2025,"Join our team as an Interior Designer in an expanding company and become a key part of a dynamic, customer-focused operation. We encourage all interested candidates to apply, as all applications will be evaluated.Let’s meet to talk about it ! :)"
162,44829,Trainee Engineer,Engineering Services,AXIS ENGINEERS LTD,Mauritius,31.07.2025,TRAINEE/JUNIOR MECHANICAL ENGINEERPermanentQualifications and Requirements• Degree in Mechanical Engineering• A minimum of 1-3 years experience in building          services design/construction site environment.• Well versed in AutoCAD• Valid driving license (manual)
163,44823,Receptionist,Manufacturing-Electronics & Electrical Products,RENTACOLOR (MAURITIUS) LTD,Mauritius,31.07.2025,"ReceptionistServe as the first point of contact for visitors, clients, and staff.Greet guests in a professional and welcoming manner.Answer and direct incoming phone calls and emails.Manage front desk operations, appointments, and inquiries.Provide administrative support to various departments.Maintain a clean and organized reception area.Perform assigned administrative and clerical tasks, among other duties as required"
164,44822,Electronics Technician,Manufacturing-Electronics & Electrical Products,RENTACOLOR (MAURITIUS) LTD,Mauritius,31.07.2025,"Install, maintain, and repair electronic systems and devices in accordance with technical standards.Diagnose and troubleshoot faults in electronic equipment and components.Read and interpret electronic schematics, diagrams, and technical documentation.Work independently or as part of a team to complete assigned projects.Ensure compliance with safety regulations and industry best practices.Maintain records of maintenance and repairs for electronic systems.Perform assigned tasks efficiently and professionally, among other duties as required."
165,44821,Electrician,Manufacturing-Electronics & Electrical Products,RENTACOLOR (MAURITIUS) LTD,Mauritius,31.07.2025,"Senior ElectricianLead the installation, maintenance, and repair of electrical systems and equipment.Interpret blueprints, wiring diagrams, and technical specifications.Supervise and mentor junior electricians and technicians.Ensure all work complies with local electrical codes and safety standards.Conduct advanced troubleshooting and resolve complex electrical issues.Coordinate with other departments and contractors on project requirements.Manage electrical work schedules and documentation, among other duties as required."
166,44820,Electrician,Manufacturing-Electronics & Electrical Products,RENTACOLOR (MAURITIUS) LTD,Mauritius,31.07.2025,"Junior ElectricianAssist in the maintenance, installation, and repair of equipment and systems.Work under the supervision of senior technicians or engineers.Perform basic troubleshooting and diagnostics.Follow technical manuals, instructions, and safety guidelines.Learn and apply technical skills in a hands-on environment.Support team efforts in delivering efficient and reliable technical services.Carry out assigned tasks, among other duties as required"
167,44781,Trainee Engineer,Engineering Services,AXIS ENGINEERS LTD,Mauritius,31.07.2025,TRAINEE/JUNIOR MECHANICAL ENGINEER-Degree in Mechanical Engineering-Minimum 1-3 years experience-Well versed in AutoCAD-Valid driving license (Manual)Interested Candidates are invited to send their CV directly to info@axisengineers.mu
168,44778,Audit Senior,Management Consultancy Activities,GWENS PROPERTIES LTD,Mauritius,30.07.2025,"Recherche pour l’un de ses clients dans le CentreUn(e) Auditeur (trice) SeniorCompétences requises :Diplôme Bac+5 : Master CCA, école de commerce ou diplôme d’expertise comptable.Expérience significative de 2 à 3 ans dans un poste similaire.Bonne maîtrise des normes et de la méthodologie d’audit.À l’aise avec les outils informatiques (Word, Excel, PowerPoint).Excellente maîtrise du français et de l’anglais, à l’oral comme à l’écrit.Missions  :Coordonner les audits et la certification des comptes.Analyser les données recueillies et proposer des solutions aux problématiques identifiées.Veiller à la résolution des points en suspens.Rédiger la note de synthèse et/ou la revue analytique.Appliquer et faire respecter la méthodologie d’audit.Garantir le respect des normes déontologiques et entretenir ses compétences techniques.Encadrer l’équipe.Avantages :Salaire négociable entre 70K et 90kPrime de performance et d’engagement pouvant atteindre l’équivalent d’un 14e mois.Assurance médicale prise en charge à 50 % par l’entreprise.Télétravail possible jusqu’à 3 jours par semaine (après validation).Contrat à durée indéterminée (CDI).Transport rembourséHoraires :Du lundi au vendredi de 9hrs à 17hrs30Merci de nous envoyer votre CV sur recrutement@gml-mu.com ou au 52557740 / 5840 2010 par WhatsApp en précisant bien quel est le poste qui vous intéresse."
169,44768,"Driver, Van, Light and Local Transport",Human Health & Social work activities,CUREPHARMA LTD,Mauritius,31.07.2025,Valid commercial driving license appropriate for Good Vehicle.Proven experience as a delivery or truck driver.Good knowledge of local and regional routes.Physical fitness and ability to lift heavy loads.Strong time management and organizational skills.Basic mechanical knowledge is an advantage.
170,44767,Sales Representative,Human Health & Social work activities,CUREPHARMA LTD,Mauritius,31.07.2025,"Bachelor’s degree in life sciences, business, or a related field.Proven sales experience, preferably in the medical or pharmaceutical industry.Excellent communication, negotiation, and interpersonal skills.Strong organizational and time management abilities.Ability to travel within the assigned territory"
171,44739,Pastry Maker,Management Consultancy Activities,GWENS PROPERTIES LTD,Mauritius,30.07.2025,"Recherche pour l’un de ses clients dans le NordUn commis pâtissierAvantages :Salaire Rs 22,000 incluant prime de présenceTransport aller-retour pris en charge ou rembourséHeures supplémentaires rémunérées et contrat en CDIDimanche payé selon la loi du travailHoraires :Du lundi au dimanche de 07hrs00 à 15hrs001 jour off par semaineMerci de nous envoyer votre CV sur recrutement@gml-mu.com ou au 52557740 / 5840 2010 par WhatsApp en précisant bien quel est le poste qui vous intéresse."
172,44735,Serveur/Serveuse (aide-générale),Management Consultancy Activities,GWENS PROPERTIES LTD,Mauritius,30.07.2025,"Recherche pour l’un de ses clients dans le Centre:Vendeuse/ServeuseAvantages :Salaire Rs 22,800 incluant prime de présenceTransport pris en charge ou remboursés selon les horaires (pris en charge hors horaires bus, sinon rembourse au prix du ticket d’autobus)Dimanche payé selon la loi du travailHeures supplémentaires rémunérées et contrat en CDIHoraires :6 jours de travail par semaine de 05h45 à 14h15 ou 10h30 à 19h001 jour de congé par semaine et 1 dimanche off par mois (selon planning)Merci de nous envoyer votre CV sur recrutement@gml-mu.com ou au 5255 7740 / 5840 2010 par WhatsApp en précisant bien quel est le poste qui vous intéresse"
173,44734,Serveur/Serveuse (aide-générale),Management Consultancy Activities,GWENS PROPERTIES LTD,Mauritius,30.07.2025,"Recherche pour l’un de ses clients dans le Centre:Vendeuse/ServeuseAvantages :Salaire Rs 22,800 incluant prime de présenceTransport pris en charge ou remboursés selon les horaires (pris en charge hors horaires bus, sinon rembourse au prix du ticket d’autobus)Dimanche payé selon la loi du travailHeures supplémentaires rémunérées et contrat en CDIHoraires :6 jours de travail par semaine de 08h00 à 16h301 jour de congé par semaine et 1 dimanche off par mois (selon planning)Merci de nous envoyer votre CV sur recrutement@gml-mu.com ou au 5255 7740 / 5840 2010 par WhatsApp en précisant bien quel est le poste qui vous intéresse"
174,44732,Consultant,Management Consultancy Activities,GWENS PROPERTIES LTD,Mauritius,30.07.2025,"Recherche pour l’un de ses clients dans centre:Des Consultants en Voyage d’Affaires avec ou sans expérience (secteur de l’aviation)Horaires :Du lundi au dimanche (2 jours de repos par semaine et un week-end off par mois)5 horaires(obligatoires et en rotation par semaine) :7hrs à 17hrs9hrs à 19hrs11hrs à 21hrs13hrs à 23hrs21hrs30 à 7hrs30Avantages:Salaire de base Rs 26,110 incluant la prime de performancePrime de montée en compétences entre Rs 890 à Rs 4,890 à partir de 6 mois d’anciennetéContrat en CDI, formation rémunérée et 50% de l’assurance médicale payée par la sociétéDimanche rémunéré au triple et jour férié au doubleTransport aller-retour pris en charge par la sociétéMerci de nous envoyer votre CV sur recrutement@gml-mu.com ou au 52557740 / 5840 2010 par WhatsApp en précisant bien quel est le poste qui vous intéresse."
175,44730,Salesperson,Management Consultancy Activities,GWENS PROPERTIES LTD,Mauritius,30.07.2025,"Une Vendeuse en boutique (Secteur de la Décoration)Assurer un accueil chaleureux et professionnelConclure des ventes en identifiant avec succès les différentes demandes des clientsÊtre responsable de la caisse et des retours de produitsGérer les stocks, les rayons et les inventairesMaintenir la boutique propre, accueillante et ordonnéeTravailler en équipe pour atteindre les objectifs de vente"
180,44675,Finance Officer,"Electricity, Gas, Steam & Air Conditioning supply",LGI,Mauritius,30.07.2025,"• To provide a high standard of service in key financial accounting operational functions including Accounts Payable, Accounts Receivable, Cash Management, fixed assets and other functions.• This role also involves working on strict deadlines in line with the company’s policies."
181,44621,"Supervisor, Agriculture",Agriculture,GREENWORLD CO.LTD,Mauritius,31.07.2025,Greenworld Co. Ltd is an agricultural enterprise engaged in sustainable farming practices. We are seeking a dedicated and experienced Agricultural Supervisor to join our team and oversee day-to-day operations on our farms located in the Plaines Wilhems region.
186,44375,Trainer/ Instructor,Education,CONFEDERATION OF INTERNATIONAL TALENTS LTD,Mauritius,01.08.2025,"We are seeking an experienced and dynamic Management Trainer to deliver engaging and effective training programs in various management disciplines. The ideal candidate will have a strong background in management principles, proven experience in facilitating interactive training sessions, and a passion for developing talent."
189,44354,Driver-Messenger,Manufacturing-Textile & Wearing Apparel,FAIRY TEXTILES LTD,Mauritius,01.08.2025,"Deliveries, dispatching documents to offices"
190,44353,"Driver, Heavy Vehicle",Manufacturing-Textile & Wearing Apparel,FAIRY TEXTILES LTD,Mauritius,01.08.2025,Driver of heavy truck
191,44344,Trainee Engineer,Engineering Services,AXIS ENGINEERS LTD,Mauritius,31.07.2025,TRAINEE/JUNIOR MECHANICAL ENGINEER-Degree in Mechanical Engineering-Minimum 1-3 years experience-Well versed in AutoCAD-Valid driving license (Manual)Interested Candidates are invited to send their CV directly to info@axisengineers.mu
192,44290,Accounts clerk,Manufacturing-Metal Products,MRC WIRE PRODUCTS LTD,Mauritius,31.07.2025,"Join our team! We are looking for a detail-oriented Accounts/Invoicing Clerk. If you have strong organizational skills, basic accounting knowledge, and a keen eye for detail, we’d love to hear from you!"
200,44132,Marketing Assistant,Hotel,BAYSTONE BOUTIQUE HOTEL & SPA,Mauritius,31.07.2025,"The Marketing Coordinator will play a vital role in supporting the development and execution of our marketing strategies and campaigns. In this role, you will be responsible for various tasks,from conducting market research and creating content to managing campaigns and tracking results. Support with hotel guest relation activities."
201,44084,Child Carer,Education,ASSOCIATION DES PARENTS D'ENFANTS AUX BESOINS SPÉCIAUX (APEBS),Mauritius,31.07.2025,"L’APEBS recherche un(e) Carer sérieux(se) et motivé(e) pour s’occuper d’enfants.Profil recherché :Résidant dans les environs de CurepipeÂgé(e) entre 20 et 35 ansNiveau d’études minimum : Grade 9Un certificat MITD ou Polytechnics est un atoutSi vous correspondez à ce profil, merci d’envoyer votre CV à : lapebs@intnet.mu"
204,43910,Electronics Engineer,Engineering Services,SIMPLECO TECHNOLOGIES LIMITED,Mauritius,31.07.2025,"We are currently seeking for an experienced Access Control System Installation and Maintenance Engineer to join our team. In this role, you will be responsible for installing, troubleshooting, and maintaining access control system for our clients. You will work closely with our project manager and engineers to ensure the successful installation and functionality of our system."
205,43906,Electronics Technician,Engineering Services,SIMPLECO TECHNOLOGIES LIMITED,Mauritius,31.07.2025,"We are seeking for skilled and experienced CCTV & Access Control Technician to join our team. The successful candidate will be responsible for installing, maintaining, and repairing CCTV systems, access control, and security solutions for our clients."
208,43782,"Machine Operator, Printing",Advertising,ELEGANT STAR ADVERTISEMENT LTD,Mauritius,31.07.2025,"Opérateur de Machine – Signalétique & PublicitéNous recherchons un opérateur de machine qualifié pour rejoindre notre équipe au sein du département signage & advertising. Le candidat idéal devra maîtriser l’ensemble du processus de production de supports publicitaires et de signalétique, de l’impression à la pose.une expertise en impression pour la sublimation, impression numérique grand format et autres processus de production liés. Le candidat idéal aura une solide expérience en design graphique, associée à une connaissance pratique de l’exploitation des machines d’impression, de la gestion des couleurs et du choix des matériaux. Ce rôle exige à la fois de la créativité, un savoir-faire technique et la capacité d’adapter les créations aux différentes techniques d’impression tout en garantissant une qualité optimale du produit fini."
209,43780,Graphic Designer-Junior,Advertising,ELEGANT STAR ADVERTISEMENT LTD,Mauritius,31.07.2025,"Résumé du Poste – Graphiste (Spécialisé en Impression & Impression Numérique Grand Format)Nous recherchons un graphiste polyvalent et minutieux, avec une expertise en impression par sublimation, impression numérique grand format et autres processus de production liés. Le candidat idéal aura une solide expérience en design graphique, associée à une connaissance pratique de l’exploitation des machines d’impression, de la gestion des couleurs et du choix des matériaux. Ce rôle exige à la fois de la créativité, un savoir-faire technique et la capacité d’adapter les créations aux différentes techniques d’impression tout en garantissant une qualité optimale du produit fini.Responsabilités Principales :Concevoir et préparer des fichiers prêts pour l’impression pour l’impression par sublimation, l’impression numérique grand format et autres méthodes de production.Opérer et calibrer les machines d’impression par sublimation et numérique grand format.Garantir la précision des couleurs et la cohérence sur différents supports d’impression.Travailler en étroite collaboration avec l’équipe de production pour optimiser les créations pour diversRésoudre les problèmes d’impression et ajuster les paramètres pour maintenir des standards de qualité.Se tenir informé des nouvelles technologies d’impression, des matériaux et des tendances du secteur.Aider dans les étapes de finition telles que la découpe, le laminage et le montage si nécessaire."
210,43720,Shop Assistant,Manufacturing-Jewellery,SHOBHA JEWELS,Mauritius,31.07.2025,We are looking for a friendly and dynamic Shop Assistant to join our team. The ideal candidate should have good customer service skills and flexible.
217,43557,"Mechanic, Motor Vehicle",Trade,PHOENIX-GMI,Quebec-Canada,31.07.2025,"Nous offrons :- Poste permanent, temps plein, du lundi au vendredi- Excellentes conditions d’emploi- Environnement de travail moderne et sécuritaire- Support complet pour les procédures d’immigration - permis de travail."
219,43383,Electrician,Human Health & Social work activities,RGT (HEALTHCARE) LTD,Mauritius,31.07.2025,"Royal Green is looking for competent, committed, passionate, creative and enthusiastic candidates for the post of Electrician."
222,43304,"Varnisher, Furniture",Manufacturing-Furniture,ATELIER DECO LTEE,Mauritius,31.07.2025,"Prepare surfaces: Prepare surfaces for varnishing by sanding, cleaning, or derustingMix paints and varnishes: Mix paints and varnishes according to the project requirementsApply varnish: Apply varnish to surfaces using brushes, rollers, or sprayersFollow safety precautions: Follow health and safety precautions to ensure effective and efficient applicationInspect surfaces: Inspect surfaces for defects or problems"
