id,job_id,title,sector,employer,country,closing_date,summary
1,27011,Soudeur Assembleur,Trade,PHOENIX-GMI,Quebec-Canada,31.07.2025,"L’entreprise, originalement spécialisée dans la conception et la fabrication de véhicules de transport pour le domaine forestier, est désormais un leader au Québec dans les industries du châssis, du transport de marchandises lourdes, du transbordement des déchets et matières recyclables et de la ferraille.Les semi-remorques que l’entreprise fabrique se démarquent par leur robustesse, leur fiabilité et leur durabilité. L’entreprise a le souci d’adapter ses produits aux besoins de ses clients et puise dans ses racines pour toujours offrir la qualité qui a fait sa réputation.Aucun frais ou participation demandé.e aux candidats, l’employeur prend en charge :• les formalités d’immigration et stratégie à long terme• les frais de voyage• les services d’accompagnement à l’installation avec la recherche du logement, équipement, formalités administratives.• la préparation et suivi à l’intégration culturelle et professionnelle"
4,45273,Waiter/Waitress,Hotel,MARITIM RESORT & SPA MAURITIUS,Mauritius,31.07.2025,To deliver professional and friendly service to guests in all allocated outlets and during various catering functions.
7,45270,Trainee Engineer,Engineering Services,AXIS ENGINEERS LTD,Mauritius,31.07.2025,TRAINEE/JUNIOR MECHANICAL ENGINEER-Degree in Mechanical Engineering-Minimum 1-3 years experience-Well versed in AutoCAD-Valid driving license (Manual)
14,45263,"Driver, Truck/Goods Vehicle/Chauffeur Poid-Lourd",Trade,PERFECT LOGISTICS LTD,Mauritius,31.07.2025,LOOKING FOR DRIVERS-TRAILERS-HAMMER-LORRY 4T
23,45254,Waiter/Waitress,Restaurant,GREEN IS BETTER (MAURITIUS ) LTD,Mauritius,31.07.2025,Customer service
25,45252,Cashier,Restaurant,GREEN IS BETTER (MAURITIUS ) LTD,Mauritius,31.07.2025,Process customer transactions efficiently
26,45251,"Cook, General",Restaurant,GREEN IS BETTER (MAURITIUS ) LTD,Mauritius,31.07.2025,Responsible for preparing and cooking food according to recipe
42,45235,Bookbinder and Cutter (Hand),Manufacturing-Other,NORTH SIGNS LTD,Mauritius,31.07.2025,"Book Binder Key Responsibilities:• Prepare Materials:o Receive and review materials such as printed pages, covers, and endpapers.o Trim or cut materials to the required size and shape.o Ensure that all components (pages, covers, spine) are properly aligned and ready for binding.• Bind Books:o Operate various binding machineso Assemble book signatures (groupings of pages) and bind them together using appropriate techniqueso Apply covers to the bound pages and attach them securely to the spine.• Quality Control:o Inspect finished books for quality, ensuring they meet company standards for alignment, trimming, and durability.o Ensure that there are no defects, such as misprints, loose pages, or improper binding.o Perform necessary adjustments to binding machines to ensure precision.• Maintenance and Cleaning:o Maintain and clean binding equipment and machines to ensure they function properly.• Collaboration:o Work closely with other team members, including printers and quality control specialists, to ensure timely completion of orders.o Follow instructions from supervisors regarding production schedules and deadlines."
45,45232,Helper Machinist,Manufacturing-Textile & Wearing Apparel,ANSOOYA & CO LTD,Mauritius,19.07.2025,"We are looking for a motivated and hardworking Helper Machinist to support machinists in the operation, maintenance, and setup of machines. The role involves assisting with preparing materials, cleaning tools and work areas, loading/unloading parts, and ensuring smooth workflow in the machining or tailoring section. This position is ideal for someone willing to learn and grow in a technical environment."
46,45231,"Driver, Van, Light and Local Transport",Manufacturing-Textile & Wearing Apparel,ANSOOYA & CO LTD,Mauritius,12.07.2025,"We are seeking a reliable and experienced Driver to transport goods in a safe and timely manner. The Driver will be responsible for maintaining the vehicle in good condition, following all traffic laws, and ensuring all trips are completed efficiently. The ideal candidate should have a valid driver’s license, a clean driving record, and excellent knowledge of local routes."
53,45223,Waiter/Waitress,Restaurant,GREEN IS BETTER (MAURITIUS ) LTD,Mauritius,31.07.2025,Customer  service
54,45222,"Cook, General",Restaurant,GREEN IS BETTER (MAURITIUS ) LTD,Mauritius,31.07.2025,Prepares and cook food according to recipe
56,45220,"Cook, General",Management Consultancy Activities,GWENS PROPERTIES LTD,Mauritius,30.07.2025,"Recherche pour l’un de ses clients dans le Nord:Un commis de cuisineCompétences requises :Très bonne présentationExpérience au même poste obligatoireCapacité d’être indépendant et rapidePersonne responsable, ponctuelle et organiséeAvantages :Salaire de Rs 24,000 incluant prime de présenceTransport aller-retour prise en charge ou rembourséeHeures supplémentaires rémunérées et contrat en CDIDimanche payé selon la loi du travailHoraires :Du lundi au dimanche de 01h30 am à  8h30 am1  jour de congé par semaine  (selon planning)Merci de nous envoyer votre CV sur recrutement@gml-mu.com ou au 52557740/58402010 par WhatsApp en précisant bien quel est le poste qui vous intéresse."
57,45219,Bakery Operator,Management Consultancy Activities,GWENS PROPERTIES LTD,Mauritius,30.07.2025,"Recherche pour l’un de ses clients dans l’ouest:Un Commis boulangerCompétences requises :Très bonne présentationExpérience au même poste obligatoireCapacité d’être indépendant et rapideAvantages :Salaire de base Rs 24,000 incluant une prime de présenceTransport aller-retour pris en charge rembourséHeures supplémentaires rémunérées et contrat en CDIDimanche payé selon la loi du travailHoraires :Du lundi au dimanche de 1h00 am à 09h00 am1 jour off par semaineMerci de nous envoyer votre CV sur recrutement@gml-mu.com ou au 5255 7740 / 5840 2010 par WhatsApp en précisant bien quel est le poste qui vous intéresse"
58,45218,Bakery Operator,Management Consultancy Activities,GWENS PROPERTIES LTD,Mauritius,30.07.2025,"Recherche pour l’un de ses clients dans l’ouest:Un boulangerCompétences requises :Très bonne présentationExpérience au même poste obligatoireCapacité d’être indépendant et rapideAvantages :Salaire de base Rs 28,000 incluant une prime de présenceTransport aller-retour pris en charge rembourséHeures supplémentaires rémunérées et contrat en CDIDimanche payé selon la loi du travailHoraires :Du lundi au dimanche de 1h00 am à 09h00 am1 jour off par semaineMerci de nous envoyer votre CV sur recrutement@gml-mu.com ou au 5255 7740 / 5840 2010 par WhatsApp en précisant bien quel est le poste qui vous intéresse"
59,45217,Cashier,Restaurant,GREEN IS BETTER (MAURITIUS ) LTD,Mauritius,31.07.2025,Processing customer transactions and handling paymentHandling payment and customer service
60,45216,Administrative Officer,Management Consultancy Activities,ZENITH CONSULTANCY LTD,Mauritius,31.07.2025,Administrative Officers manage the daily tasks of a company or organization by providing administrative and clerical support
67,45207,Sales Assistant,Renewable Energy and Circular Economy,RENEWORLD LTD,Mauritius,27.07.2025,"As the Sales Coordinator, you will oversee the administrative tasks associated with client files. You will serve as a vital liaison between departments, ensuring the seamless transfer of information from the sales team to other teams. Additionally, you will support the teams by engaging with customers whenever necessary, fostering smooth and efficient communication."
68,45206,Pastry Maker,Management Consultancy Activities,GWENS PROPERTIES LTD,Mauritius,27.07.2025,"Recherche pour l’un de ses clients dans le Sud-Ouest:Un(e) Pâtissier(ère)Compétences requises :Très bonne présentationExpérience à un poste similaire obligatoireCapacité à être autonome et rapideHoraires :Du lundi au dimanche, de 01hrs am à 9hrs am ou de 06hrs am à 14hrs pm1 jour de congé par semaine  (selon le planning)Avantages:Salaire de base  Rs 28,000 incluant la prime de présence (Négociable)Transport pris en charge ou rembourséHeures supplémentaires rémunéréesContrat en CDIDimanche payé selon la loi du travailMerci de nous envoyer votre CV sur recrutement@gml-mu.com ou au 5255 7740 / 5840 2010 par WhatsApp en précisant bien quel est le poste qui vous intéresse"
69,45204,Human Resource Officer,Construction,WENSENG INTERNATIONAL CO LTD,Mauritius,30.07.2025,Head the Hr Department administrative job
79,45191,Trainee Engineer,Renewable Energy and Circular Economy,GREENYELLOW INDIAN OCEAN,Mauritius,31.07.2025,"Objective of the RoleThe trainee will gain hands-on experience in Solar Performance Analysis and Energy Efficiency (EE) Optimisation, working alongside experienced professionals in both domains. This structured 2-year program will prepare the candidate for a future role in renewable energy asset management."
84,45181,Housemaid,Private Household,WU WENSHENG,Mauritius,31.07.2025,"responsible For the clealiness of the household , Provide support for daily living activities"
88,45167,Maintenance Technician,Manufacturing-Food Products & Beverages,FOOD CANNERS LTD,Mauritius,31.07.2025,"Maintenance repair, preventive maintenance, installations and troubleshooting of plant equipment"
89,45166,Store and Stock Controller,Restaurant,GREEN IS BETTER (MAURITIUS ) LTD,Mauritius,30.07.2025,Ability to manage inventory levels to meet business needs
90,45165,Finance Officer,Restaurant,GREEN IS BETTER (MAURITIUS ) LTD,Mauritius,30.07.2025,Responsible for managing an organization’s financial transaction.
91,45164,"Driver, Van, Light and Local Transport",Restaurant,GREEN IS BETTER (MAURITIUS ) LTD,Mauritius,30.07.2025,Delivering and transporting goods
92,45163,Machine Operators,Manufacturing-Food Products & Beverages,FOOD CANNERS LTD,Mauritius,31.07.2025,"Operate equipment in Production, Labelling and Store section"
93,45162,Factory Attendant,Manufacturing-Food Products & Beverages,FOOD CANNERS LTD,Mauritius,31.07.2025,"Conduct manual task in Production, Store and Labelling Section related to the manufacturing processes"
94,45159,Golf Cart Attendant,Hotel,AVALON GOLF ESTATE,Mauritius,31.07.2025,"The Golf Operation Attendants will anticipate and fulfill customer needs in a variety of responsibilities as assigned which may include work in Practice Range,  Driving Range, Starting and/or Course Play"
95,45158,Kitchen Steward,Hotel,AVALON GOLF ESTATE,Mauritius,31.07.2025,"Ensure the kitchen is clean, well maintained and organised at all timesEnsure floors are dry and clean at all times.Organize cleaning chemicals and supplies and check chemical inventoryCollect and remove trash from all areas of the operation following established procedures."
96,45157,Waiter/Waitress,Hotel,AVALON GOLF ESTATE,Mauritius,31.07.2025,"To execute all mise-en-place duties and responsibilities as directed, on time, according to the predetermined standardsTo engage in food and beverage service delivery as per the predetermined standards and sequence."
98,45150,"Driver, Truck/Goods Vehicle/Chauffeur Poid-Lourd",Agriculture,GREENWORLD CO.LTD,Mauritius,31.07.2025,"Greenworld Co. Ltd is an agricultural enterprise engaged in sustainable farming practices. We are looking for a reliable Goods Vehicle Driver to handle the safe and timely transport of agricultural produce, materials, and equipment across various locations in Mauritius. The role also involves basic vehicle maintenance and assisting with loading and unloading when required."
99,45149,"Carer, Private Household",Human Health & Social work activities,THE GENIUS IN X RAYS LTD,Mauritius,31.07.2025,"TO TAKE CARE OF AN ELDERLY LADYDO HOUSEHOLD JOBS, CLEANING, IRONING AND COOKING"
100,45147,Nursing Officer,Human Health & Social work activities,THE GENIUS IN X RAYS LTD,Mauritius,31.07.2025,TO ATTEND PATIENTS AND ASSIST DOCTORS
101,45146,Pharmacy Dispenser,Human Health & Social work activities,THE GENIUS IN X RAYS LTD,Mauritius,31.08.2025,TO WORK AS PHARMACY DISPENSER IN A PHARMACY IN PAMPLEMOUSSES
102,45145,Housemaid,Human Health & Social work activities,THE GENIUS IN X RAYS LTD,Mauritius,31.07.2025,"TO TAKE CARE OF ELDERLY LADY, DO HOUSEHOLDS WORKS AND COOKING"
103,45142,Cleaner,Real Estate,BROLL INDIAN OCEAN LTD,Mauritius,30.07.2025,"We are seeking reliable and detail-oriented cleaners to maintain cleanliness and hygiene standards in assigned facilities. The cleaning operative will be responsible for performing a variety of cleaning tasks including sweeping, mopping, dusting, sanitising restrooms, emptying bins and replenishing supplies."
106,45137,Administrative Assistant,Manufacturing-Other,FOODS WORTH CO LTD,Mauritius,31.07.2025,"Foods Worth Co Ltd (Maubon) is searching for an Administrative Assisant/Secretary, preferably with experience and residing in the South. Candidates should have good knowledge of manipulating Softwares (Windows), knowledge in managing Microsoft Office (Word, Excel, Powerpoint, etc..), emails and Management Softwares as Quickbooks would be a surplus."
108,45130,"Driver, Bus",Transport and Storage,UBS TRANSPORT LTD,Mauritius,31.07.2025,Driving of buses
109,45125,Project Manager/Leader,Construction,WENSENG CONTRACTING CO LTD,Mauritius,31.07.2025,"resources alloocation , ensure skateholders satisfaction , ensure that projects are completed on time , edit promotional deals for hotel conciergerie"
110,45121,"Driver, Van, Light and Local Transport",Cleaning Services,KEEP CLEAN LTD,Mauritius,05.08.2025,Filling of daily planning sheetCollect purchases from suppliersDelivery of materials on site
112,45114,Human Resource Assistant,Construction,SERVENG LIMITED,Mauritius,31.07.2025,"Renewal of all permits relating to HR Department,Managing expatriates and mauritian workers"
113,45113,Human Resource and Expatriate Coordinator,Construction,SERVENG LIMITED,Mauritius,31.07.2025,"Management of expatriate workersRenew work permit, residence permit, manage dormitories, knowledge of the labour law"
118,45099,Sales Representative,Banking & Finance,ASSURLAND BROKERS (MAURITIUS) LTD,Mauritius,31.07.2025,"Rejoignez Notre Equipe en tant que Commercial(e) en Assurance !Nous recherchons un(e) commercial(e) en Assurance dynamique et motivé(e) pour renforcer notre équipe. Si vous êtes passionné(e) par le conseil, la relation client et que vous avez le sens du défi, cette opportunité est faite pour vous !"
119,45098,Room Attendant,Hotel,RIU LE MORNE,Mauritius,31.07.2025,"???? Join Our Global Family at RIU Hotels & Resorts!With over 100 hotels in 20+ countries and more than 70 years of hospitality excellence, RIU Hotels & Resorts is a global leader known for exceptional service, innovation, and warm hospitality. In June 2024, we proudly opened RIU Turquoise and RIU Palace Mauritius, forming the largest hotel cluster in Mauritius on the iconic Le Morne Brabant peninsula.Join us as we continue to redefine luxury and excellence. Whether you’re seeking to grow your career, explore new horizons, or work with a dynamic, inclusive team, RIU Turquoise and RIU Palace Mauritius offer unparalleled opportunities to thrive.Position: Room AttendantDepartment: Housekeeping???? About the RoleAs a Room Attendant, you will play a key role in maintaining the cleanliness and comfort of guest rooms, ensuring that every guest has an exceptional stay. This position is ideal for individuals who take pride in their work and excel in delivering high standards of cleanliness and organization.???? What You’ll DoClean and service guest rooms to the highest standards, ensuring they are spotless and welcoming.Replace linens, towels, and amenities as needed, ensuring consistency and attention to detail.Report any maintenance issues or lost and found items promptly to the housekeeping supervisor.Organize and restock housekeeping carts with necessary supplies for the day.Assist in maintaining public areas, hallways, and service areas as required.Provide courteous and professional service to guests, addressing their needs with discretion.?? What We’re Looking ForPrevious housekeeping experience is preferred but not essential—training will be provided.A strong attention to detail and commitment to maintaining high cleanliness standards.Physical stamina to perform cleaning tasks and work on your feet for extended periods.A positive attitude and team-oriented approach to contribute to a collaborative work environment.???? What You’ll GetAttractive Remuneration Package and Bonuses: Enjoy a competitive salary and bonuses as part of our commitment to rewarding your work.Access to Company Healthcare: After completing one year of service, you’ll gain access to healthcare coverage, with 50% of the cost covered by the company.Efficient Staff Transport: We provide reliable and efficient transport options for all employees to ensure a stress-free commute.Nutritive Meals While on Duty: Enjoy well-balanced, nutritious meals to keep you energized during your work hours.Special Discounts: Benefit from exclusive discounts at all RIU Hotels & Resorts worldwide, giving you the opportunity to explore our global properties.???? Why RIU Hotels & Resorts?Your Growth is Our Priority: At RIU Hotels & Resorts, we believe in nurturing talent from within. We are proud to provide our team members with opportunities to advance their careers through training, mentorship, and internal promotions, ensuring your potential is recognized and rewarded—whether locally or internationally.A Culture of Belonging: Join a team where your ideas and efforts truly matter. We foster an inclusive, collaborative environment where every voice is heard, and success is celebrated together.Rewarding Your Commitment: Enjoy a career with competitive compensation, employee benefits, and perks that reflect our appreciation for your dedication and excellence.???? Our CommitmentAt RIU Hotels & Resorts, we value diversity, equity, and inclusion as fundamental pillars of our success. We welcome all applications, regardless of gender, ethnicity, religion, disability, age, sexual orientation, or gender identity. We believe that a diverse team enriches our culture and drives excellence in service.Additionally, we are firmly committed to sustainability and social responsibility. Through our Proudly Committed strategy, we place sustainability at the heart of all our decisions. This program reflects our dedication to minimizing environmental impact, promoting responsible practices, and making a positive contribution to the communities where we operate.By joining RIU, you will become part of a company that not only strives for service excellence but also aims to create a positive impact on the world.Apply here! https://jobs-asia.riu.com/jobs/5320391-room-attendant"
121,45096,Maintenance Technician,Hotel,RIU LE MORNE,Mauritius,31.07.2025,"Join Our Global Family at RIU Hotels & Resorts!At RIU Hotels & Resorts, we’ve been shaping unforgettable experiences for over 70 years. With over 100 hotels in 20+ countries, we are a global leader in hospitality, renowned for exceptional service, innovation, and warm hospitality. Join a company that invests in your growth, celebrates diversity, and offers limitless opportunities to thrive.Position: Senior Maintenance TechnicianDepartment: Maintenance???? About the RoleThis is a unique opportunity to join RIU Hotels & Resorts as a Senior Maintenance Technician. In this role, you will be integral in performing routine maintenance and repairs on hotel equipment and systems. You’ll leverage your expertise in General Maintenance to contribute to our commitment to excellence and innovation.???? What You’ll DoPerform routine maintenance and repairs on hotel equipment and systems.Conduct inspections to identify and resolve issues promptly.Ensure the hotel’s facilities are in optimal condition, ensuring guest satisfaction.Collaborate with other departments to maintain a safe and functional environment.?? What We’re Looking ForSomeone who has a passion for hospitality and creating a seamless experience for guests.Previous experience in a similar role is preferred but not mandatory.You should have excellent problem-solving skills, a proactive attitude, and the ability to work efficiently in a fast-paced environment.???? Why RIU Hotels & Resorts?Your Growth is Our Priority: At RIU Hotels & Resorts, we believe in nurturing talent from within. We are proud to provide our team members with opportunities to advance their careers through training, mentorship, and internal promotions, ensuring your potential is recognized and rewarded—whether locally or internationally.A Culture of Belonging: Join a team where your ideas and efforts truly matter. We foster an inclusive, collaborative environment where every voice is heard, and success is celebrated together.Rewarding Your Commitment: Enjoy a career with competitive compensation, employee benefits, and perks that reflect our appreciation for your dedication and excellence.???? Our CommitmentAt RIU Hotels & Resorts, we value diversity, equity, and inclusion as fundamental pillars of our success. We welcome all applications, regardless of gender, ethnicity, religion, disability, age, sexual orientation, or gender identity. We believe that a diverse team enriches our culture and drives excellence in service.Additionally, we are firmly committed to sustainability and social responsibility. Through our Proudly Committed strategy, we place sustainability at the heart of all our decisions. This program reflects our dedication to minimizing environmental impact, promoting responsible practices, and making a positive contribution to the communities where we operate.By joining RIU, you will become part of a company that not only strives for service excellence but also aims to create a positive impact on the world."
122,45095,Waiter/Waitress,Hotel,RIU LE MORNE,Mauritius,31.07.2025,"???? Be Part of a Global Legacy with RIU Hotels & Resorts! ????At RIU Hotels & Resorts, we’ve been shaping unforgettable experiences for over 70 years. With more than 100 hotels across 20+ countries, we are a global leader in hospitality, renowned for exceptional service and warm hospitality. Join a company that values your growth, celebrates cultural diversity, and offers limitless opportunities to thrive.???? Position: Waiter???? Department: Food and Beverage???? About the RoleAs a Waiter, you will be at the heart of our dining experience, ensuring every guest enjoys impeccable service and attention to detail. You will be responsible for delivering exceptional hospitality, anticipating guest needs, and contributing to a seamless operation in our restaurants and bars. Your dedication and enthusiasm will help create memorable experiences for our guests.???? What You’ll Do? Greet and guide guests to ensure an outstanding dining experience.????? Take and serve orders efficiently, always adhering to service standards.???? Ensure cleanliness and readiness of the dining area at all times.???? Work collaboratively with the team to exceed guest expectations.?? What We’re Looking For? A passion for hospitality and delivering excellent service.???? Prior experience in food and beverage service is preferred.???? Ability to thrive in a fast-paced, team-oriented environment.???? Strong communication skills, with English proficiency preferred; additional languages are a plus.???? Why RIU Hotels & Resorts????? Work in inspiring and beautiful destinations around the world.???? Be part of a diverse global team operating in over 20 countries.???? Benefit from continuous learning and opportunities for career advancement.???? Enjoy a positive and inclusive workplace that values your contributions.???? Inclusivity & Non-DiscriminationAt RIU Hotels & Resorts, we are committed to creating an environment where everyone feels valued and respected. We celebrate diversity and are proud to be an equal-opportunity employer. All applicants will be considered without regard to race, color, religion, gender, sexual orientation, national origin, disability, or age. Your individuality makes us stronger! ????"
